,user_id,date,content_2,sentiment_label,sentiment_score
2794,196208994,2020-07-24 10:56:01+00:00,JASA FOTO MAKANAN JABODETABEK &gt;&gt; WA: 0878-2240-1343 &gt;&gt; Follow IG : bwellphotovideo  #makanan #minuman #kafe #cafe #restoran #kekinian #jamannow #bisnis #usaha #pengusaha #wirausaha #pebisnis #ukm #umkm  #jakarta #depok #bogor #jaksel #jakbar #jaktim #jakpus #jakut #bintaro,neutral,0.9473645687103271
2789,17588443,2020-07-25 11:32:18+00:00,"Ketua Asosiasi Usaha Mikro, Kecil dan Menengah Indonesia, Ikhsan Ingratubun, meminta Pemprov DKI Jakarta meninjau ulang larangan penggunaan kantong plastik. ""Ini kontraproduktif dengan kondisi UMKM yang terpukul pandemi.”  #MediaLawanCovid19",neutral,0.934658408164978
2770,17588443,2020-07-27 16:37:18+00:00,"Ketua Asosiasi Usaha Mikro, Kecil dan Menengah Indonesia, Ikhsan Ingratubun, meminta Pemprov DKI Jakarta meninjau ulang larangan penggunaan kantong plastik. ""Ini kontraproduktif dengan kondisi UMKM yang terpukul pandemi,"" katanya.  #MediaLawanCovid19",neutral,0.8622009158134459
2765,975739559051800579,2020-07-28 15:09:14+00:00,"ADALO INDONESIA  #adaloindonesia  #adalo  #sneakers  #fasioncowok  #sendalslop  #coronavirus  #sendalmurah  #kadoultah  #umkm  #umkmindonesia @ Jakarta, Indonesia",neutral,0.9929787516593932
2762,202559038,2020-07-29 08:18:26+00:00,"Jakarta,",neutral,0.9884496927261353
2753,713546221,2020-08-01 02:18:15+00:00,"Buat kamu yg tinggal di Jakarta dan sekitarnya, yg nggak bisa nggak sempat atau malas masak cobain ayam ungkep dari Sari Rasa Catering. Bumbunya meresap sampai ke dalam dan yg penting kalian nggak repot lagi 😉👌 #katering #catering #umkm #food",positive,0.9821340441703796
2748,196208994,2020-08-02 11:00:01+00:00,JASA FOTO MAKANAN JABODETABEK &gt;&gt; WA: 0878-2240-1343 &gt;&gt; Follow IG : bwellphotovideo  #makanan #minuman #kafe #cafe #restoran #kekinian #jamannow #bisnis #usaha #pengusaha #wirausaha #pebisnis #ukm #umkm  #jakarta #depok #bogor #jaksel #jakbar #jaktim #jakpus #jakut #bintaro,neutral,0.9473645687103271
2747,236364142,2020-08-03 04:54:41+00:00,#bolu #bolugulung #jualkue #shopee #tokopedia #jualbolu #halal #jualan #umkm #bukalapak #jakarta,neutral,0.954133152961731
2746,48206047,2020-08-03 06:46:01+00:00,"KADIN INDONESIA is inviting you to a scheduled Zoom meeting.  Topic: BINCANG UMKM "" IJIN USAHA UMKM"" Time: Aug 5, 2020 09:30 AM Jakarta  Join Zoom Meeting https://t.co/YWUuqRewIq  Meeting ID: 820 2362 0595 Passcode: 997153",neutral,0.9892852902412416
2745,870912618965237764,2020-08-03 08:28:20+00:00,"Berkolaborasi dengan @wpbks,  WPJKT Meetup #25: Mengoptimasi Core Web Vitals dan WordPress untuk UMKM  Sabtu, 8 Agustus 2020 19:30 - 21:00 WIB  Pembicara: 1. Adrianti Rusli, Frontend Engineer 2. Cahyo Pambudi, Ecommerce Admin di Auto2000 Head Office  #WordPress #Meetup #Jakarta",neutral,0.98099946975708
2741,3188303792,2020-08-04 08:35:39+00:00,Selamat sore #kawaniaga kali ini FTA Center Jakarta akan memberi info mengenai Incorerms 2020: Perpindahan Risiko Antar Pihak Dalam Proses Perdagangan Ekspor. Apa itu Incoterms? #ekspor #incoterms2020 #ftacenterjakarta #ftacenterjkt #kemendag #kementerianperdagangan #ukm #umkm,neutral,0.9915190339088441
2735,1290655824076054532,2020-08-07 02:17:26+00:00,Jangan menyerah jika kamu di keluarkan dari pekerjaan #umkm #jakarta #bali #indonesia https://t.co/JwDj5HhR1j,neutral,0.9764581918716432
2734,1024559821226311680,2020-08-07 02:23:50+00:00,"Webinar KIP menghadirkan narasumber Staf Khusus Menteri Keuangan, Bapak Yustinus Prastowo yang memaparkan ""Dukungan bagi UMKM di Masa Pandemi Covid-19"" dan Ketua Kadin DKI Jakarta, Ibu Diana Dewi dengan pemaparan ""Tantangan dan Harapan UMKM dalam Menghadapi Pandemi Covid-19"".",neutral,0.9454985857009888
2733,1169861863426818048,2020-08-07 03:26:35+00:00,"Kamar Dagang dan Industri (Kadin) DKI Jakarta mendorong pemerintah untuk memperpanjang dan menggencarkan stimulus kepada usaha mikro, kecil dan menengah (UMKM). Itu semata-mata untuk keberlangsungan bisnis UMKM. Selengkapnya  https://t.co/mW7fB8CxKF",neutral,0.9956886172294616
2727,2787804523,2020-08-07 09:31:19+00:00,"Di tengah pandemi, edukasi dan motivasi sangat diperlukan oleh UMKM agar dapat tetap bertahan. Kanwil DJP Jakarta Barat bekerja sama dengan Badan Pendidikan dan Pelatihan Keuangan (BPPK) Kementerian Keuangan menyelenggarakan ""Webinar Edukasi dan Pembinaan UMKM se-DKI Jakarta"".",neutral,0.9515767693519592
2726,2787804523,2020-08-07 09:31:24+00:00,"Diikuti oleh kurang lebih 500 peserta, acara berlangsung sangat menarik. Pembahasan terkait Insentif Pajak bagi UMKM dikupas tuntas oleh narasumber dari Kanwil DJP Jakarta Barat, Fathimati Zahra, dan narasumber dari PKN STAN, Sulfan.",positive,0.8764997124671936
2724,1283087592464896000,2020-08-07 14:28:27+00:00,UMKM merupakan salah satu Program KKN Wajib UMJ.  @um_jakarta  @kkn.umj  @kknumj19_20  #kknonlineumj2020 #kknumj #lppmumj #pmbumj #ftanumj #agroteknologi,neutral,0.9820368885993958
2723,1290655824076054532,2020-08-07 15:23:14+00:00,@hrdbacot Jangan menyerah jika kamu di keluarkan dari pekerjaan #umkm #jakarta #bali #indonesia,neutral,0.6666058301925659
2722,1290655824076054532,2020-08-07 15:23:58+00:00,@THaripriambodo @RajaGuguk14 @DonAdam68 @evalez_fr @mulaigerak Jangan menyerah jika kamu di keluarkan dari pekerjaan #umkm #jakarta #bali #indonesia,neutral,0.9448576569557191
2721,1290655824076054532,2020-08-07 15:24:44+00:00,@ansiboi Jangan menyerah jika kamu di keluarkan dari pekerjaan #umkm #jakarta #bali #indonesia,negative,0.5423640012741089
2720,1290655824076054532,2020-08-07 15:24:57+00:00,@kidjangsatu @AJIIndonesia Jangan menyerah jika kamu di keluarkan dari pekerjaan #umkm #jakarta #bali #indonesia,neutral,0.8875356316566467
2719,1290655824076054532,2020-08-07 16:09:13+00:00,@WuArlex Jangan menyerah jika kamu di keluarkan dari pekerjaan #umkm #jakarta #bali #indonesia,neutral,0.6379185914993286
2718,927438599745806338,2020-08-07 16:47:38+00:00,"KAHMIPreneur : Pasar Modal solusi Pendanaan UMKM   Kerjasama dalam bidang Inkubator Bisnis UMKM, Sosialiasi dan edukasi tentang Pasar Modal, Program Pasar Modal Goes To Campus.   Main Hall Bursa Efek Indonesia, Jakarta Jumat 7 Agustus 2020",neutral,0.9854178428649902
2717,1290655824076054532,2020-08-07 19:43:18+00:00,@Quvvatt Jangan menyerah jika kamu di keluarkan dari pekerjaan #umkm #jakarta #bali #indonesia,neutral,0.6272287368774414
2714,196208994,2020-08-08 02:26:02+00:00,JASA FOTO MAKANAN JABODETABEK &gt;&gt; WA: 0878-2240-1343 &gt;&gt; Follow IG : bwellphotovideo  #makanan #minuman #kafe #cafe #restoran #kekinian #jamannow #bisnis #usaha #pengusaha #wirausaha #pebisnis #ukm #umkm  #jakarta #depok #bogor #jaksel #jakbar #jaktim #jakpus #jakut #bintaro,neutral,0.9473645687103271
2713,70627173,2020-08-08 06:27:01+00:00,"@DramaAnker @airlangga_hrt Iya saya pernah ketemu Pak @airlangga_hrt di pameran UMKM di Jakarta tahun lalu. Indonesia butuh UMKM utk memajukan perekonomian, salah satunya usaha KayaID utk membantu memutar roda tsb",neutral,0.6837752461433411
2711,3105912422,2020-08-08 13:35:24+00:00,"Selama pandemi Covid-19, UMKM merupakan kelompok rentan yang paling terdampak dari aspek ekonomi. Untuk itu, Pemprov DKI Jakarta mengajak kamu untuk membangkitkan kembali ekonomi kerakyatan di Jakarta melalui UMKM KSBB.  Simak infografik untuk info lengkapnya.  #JakartaSmartCity",neutral,0.9912686347961426
2709,86934018,2020-08-09 13:12:38+00:00,"Ketua Kamar Dagang dan Industri (Kadin) DKI Jakarta Diana Dewi mengungkapkan, sebanyak 85,42% dari seluruh pelaku UMKM hanya mampu bertahan selama satu tahun di tengah pelemahan ekonomi akibat covid-19.",neutral,0.9953188300132751
2694,1346502348,2020-08-10 22:58:35+00:00,"Prof.DR. Basuki Ranto: Penguatan Modal Kerja adalah Stimulus yang Diperlukan Untuk Mendorong Bergeraknya UMKM: Jakarta-Direktur Lembaga Kajian Bisnis dan UMKM TRIGATRA, Prof.DR. Basuki Ranto, menegaskan, kendati pemerintah telah memberikan kebijakan…",neutral,0.9938330650329591
2685,871607581449437185,2020-08-11 04:24:38+00:00,"Di Jakarta (22 Juni 2020) dan di Indramayu (1 Juli 2020), PDSI mengumpulkan rekan-rekan pelaku UMKM dan memberikan pelatihan e-commerce untuk mereka. Harapannya tentu agar mereka bisa bertahan atau bahkan bisa semakin bertumbuh di masa pandemi ini.",neutral,0.79770427942276
2684,3150863989,2020-08-11 04:51:53+00:00,"Hello warga Jakarta, Dalam Rangka Mendorong Aktivitas Perekonomian pada Masa Pandemi Covid-19 dan mendukung Program Kolaborasi Sosial Berskala Besar (KSBB-UMKM) , Pemerintah Provinsi DKI Jakarta melaksanakan…",neutral,0.9883375763893129
2683,551572975,2020-08-11 05:41:47+00:00,"Pelatihan Digital Marketing bersama teman2 UMKM binaan Balai Diklat Industri Jakarta, Kementrian Perindustrian dan Perdagangan Indonesia, mempelajari bagaimana memanfaatkan Facebook &amp; Instagram Ads untuk meningkatkan Brand &amp; Sales Produk.",neutral,0.9783207178115844
2679,3326010492,2020-08-11 09:18:17+00:00,"Guna meningkatkan perekonomian Indonesia, Peruri terus memberikan dukungan &amp; berkolaborasi dgn UMKM yang ada di Indonesia, salah satunya melalui pendirian Rumah Kreatif BUMN di Karawang, M Bloc Space di Jakarta Selatan dan Kawasan Kreo Clothing di Tangerang.   #BUMNBangkitkanUMKM",neutral,0.9190294742584229
2675,271864689,2020-08-12 03:20:57+00:00,"Halo Sobat Kredibel!  Kepala LKPP Roni Dwi Susanto belum lama ini menyambangi pusat perbelanjaan UMKM di Jakarta.  Sambil membeli batik Madura, Kepala LKPP berharap perekonomian Indonesia dapat bangkit melalui UMKM.  #LKPP #BanggaBuatanIndonesia #PasarSabangMerauke",neutral,0.9235856533050536
2674,743319071559606273,2020-08-12 04:25:13+00:00,Selamat Hari UMKM Nasional 2020.   Salah satu kunci kesuksesan Pemulihan Ekonomi Nasional adalah pada Pelaku UMKM. Pelaku UMKM merupakan tulang punggung perekonomian Bangsa Indonesia. Pemprov DKI Jakarta terus…,neutral,0.8162622451782227
2672,1232304693835026433,2020-08-12 10:47:02+00:00,"UMKM Kuat INDONESIA Berdaulat  Semangat!  #aqalin #aqalinaja #semuadiaqalinaja #connectlinksolution #umkm #pedagang @ Jakarta, Indonesia",neutral,0.9891140460968018
2664,829156009297924096,2020-08-12 16:43:55+00:00,UMKM Movement adalah webinar yang diselenggarakan serentak di 12 kota di seluruh Indonesia dan ditutup di kota Jakarta yang merangkul para pelaku UMKM melalui edukasi dan solusi bisnis.  @telkomsel #TelkomselTerusbergerakmaju,neutral,0.9811295866966248
2663,829156009297924096,2020-08-12 16:44:16+00:00,"Program UMKM Movement sendiri diselenggarakan serentak di 12 kota di seluruh Indonesia, yaitu Pekanbaru, Lampung, Medan, Bandung, Cirebon, Surabaya, Yogyakarta, Balikpapan, Banjarmasin, Malang, Makassar, Manado dan ditutup di kota Jakarta.  @telkomsel #TelkomselTerusbergerakmaju",neutral,0.9842696189880372
2657,26144550,2020-08-13 05:55:25+00:00,Seminar Zoom :  Optimasi Instagram Untuk Toko Online,neutral,0.9967453479766846
2655,4313214147,2020-08-13 12:15:06+00:00,"""Kami berharap pelaku UMKM dapat menjangkau digitalisasi (karena) potensinya luar biasa di mana untuk pasar di Indonesia dari digitalisasi bisa mencapai 125 miliar dolar AS,"" kata Airlangga Hartarto dalam diskusi daring di Jakarta, Selasa. -",neutral,0.959219217300415
2643,196208994,2020-08-14 01:30:01+00:00,JASA FOTO MAKANAN JABODETABEK &gt;&gt; WA: 0878-2240-1343 &gt;&gt; Follow IG : bwellphotovideo  #makanan #minuman #kafe #cafe #restoran #kekinian #jamannow #bisnis #usaha #pengusaha #wirausaha #pebisnis #ukm #umkm  #jakarta #depok #bogor #jaksel #jakbar #jaktim #jakpus #jakut #bintaro,neutral,0.9473645687103271
2642,68930552,2020-08-14 05:40:30+00:00,Anggota Komisi D DPRD DKI Jakarta Nova Harivan Paloh meminta agar Pemprov DKI Jakarta mencari alternatif pengganti plastik pembungkus makanan sebab plastik masih menjadi andalan bagi pengusaha UMKM kuliner dan PKL binaan Pemprov DKI dalam mengemas makanan ,neutral,0.994337260723114
2641,166596650,2020-08-14 08:08:38+00:00,Rapat DPP HIPMIKINDO utk Pendampingan UMKM yg terdampak Covid 19. #Syahnan Phalipi &amp; Co. #management Legal Specialist. #Ketua Umum founder DPP HIPMIKINDO. #Ketua Bidang strategis dan Pengembangan Koperasi Dekopin Jakarta. #CEO Java Lawyer International.,neutral,0.9930253028869628
2640,3184723542,2020-08-14 08:46:44+00:00,"Bentuk atensi Pemerintah terhadap UMKM juga diwujudkan dalam penandatanganan Kesepakatan Bersama antara Kementerian BUMN dengan Kementerian Koperasi dan UKM tentang pengembangan dan pembinaan Koperasi, Usaha Mikro, Kecil dan Menengah (KUMKM) yang berlangsung di Jakarta hari ini.",neutral,0.9942818880081176
2639,202559038,2020-08-14 11:05:15+00:00,"Jakarta,",neutral,0.9884496927261353
2638,3105912422,2020-08-14 12:00:40+00:00,"Smartcitizen, kamu ingin mengembangkan potensi usahamu? Yuk, daftarkan diri kamu di Jakpreneur!  Jakpreneur merupakan wadah yang dibuat Pemprov DKI Jakarta untuk membuka akses bagi UMKM dalam mengembangkan usahanya. Cari tahu informasi lengkapnya melalui JAKI.  #JakartaSmartCity",neutral,0.9907974004745485
2633,721519890,2020-08-15 02:40:32+00:00,Ngobrol bareng sama Agen COFFEE BEER jakarta timur,neutral,0.9808322191238404
2632,3184723542,2020-08-15 03:36:36+00:00,"Bentuk atensi Pemerintah terhadap UMKM juga diwujudkan dalam penandatanganan Kesepakatan Bersama antara Kementerian BUMN dengan Kementerian Koperasi dan UKM tentang pengembangan dan pembinaan Koperasi, Usaha Mikro, Kecil dan Menengah (KUMKM) yang berlangsung di Jakarta(14/07).",neutral,0.994730830192566
2630,196208994,2020-08-15 11:00:01+00:00,JASA FOTO MAKANAN JABODETABEK &gt;&gt; WA: 0878-2240-1343 &gt;&gt; Follow IG : bwellphotovideo  #makanan #minuman #kafe #cafe #restoran #kekinian #jamannow #bisnis #usaha #pengusaha #wirausaha #pebisnis #ukm #umkm  #jakarta #depok #bogor #jaksel #jakbar #jaktim #jakpus #jakut #bintaro,neutral,0.9473645687103271
2628,118646322,2020-08-16 09:44:02+00:00,"HUT Ke-75 RI, MRT Jakarta Gelar Lomba dan Bagikan Produk UMKM",neutral,0.9923425316810608
2624,1151137492583645184,2020-08-17 16:24:51+00:00,"TRENDING TAGS CHALLANGE.   Check ""Trends for you"" Dan bikin kalimat dari halaman itu.   ""RI merdeka 75 tahun! Semoga umkm indonesia, di jakarta, dan di seluruh indonesia bisa semakin maju. Menikmati hari sambil baca #GNFI17an dan gw baru tau ada streaming upacara hut""",positive,0.8216881752014159
2615,202559038,2020-08-18 07:32:09+00:00,"Jakarta,",neutral,0.9884496927261353
2610,118646322,2020-08-19 05:04:03+00:00,WIKA Salurkan Bantuan Puluhan Gerobak UMKM bagi Warga Jakarta Timur,neutral,0.9969287514686584
2608,1282603369496932364,2020-08-19 08:01:59+00:00,Transformasi Bisnis Sarinah memberikan dampak positif bagi UMKM bukan hanya lip service konsep mal Sarinah akan mengangkat community mall dan diharapkan menjadi ikon Jakarta atau destinasi yang wajib dikunjungi (must visit place).  #SarinahUntukIndonesia,positive,0.5017889142036438
2607,778507487032979457,2020-08-19 08:03:10+00:00,Transformasi Bisnis Sarinah memberikan dampak positif bagi UMKM bukan hanya lip service konsep mal Sarinah akan mengangkat community mall dan diharapkan menjadi ikon Jakarta atau destinasi yang wajib dikunjungi (must visit place).  #SarinahUntukIndonesia,positive,0.5017889142036438
2596,196208994,2020-08-20 11:00:01+00:00,JASA FOTO MAKANAN JABODETABEK &gt;&gt; WA: 0878-2240-1343 &gt;&gt; Follow IG : bwellphotovideo  #makanan #minuman #kafe #cafe #restoran #kekinian #jamannow #bisnis #usaha #pengusaha #wirausaha #pebisnis #ukm #umkm  #jakarta #depok #bogor #jaksel #jakbar #jaktim #jakpus #jakut #bintaro,neutral,0.9473645687103271
2593,1124345881,2020-08-20 18:32:14+00:00,"Tugas mulia, merayakan HUT ke-75 RI, PT Wijaya Karya (Persero) Tbk atau Wika menyalurkan bantuan berupa gerobak dagang usaha mikro, kecil&amp;menengah (UMKM) kpd warga kurang mampu di Kelurahan Cipinang Cempedak,Jakarta Timur, Selasa (18/8). #IndonesiaMaju  https://t.co/lhxtaAZQGV",neutral,0.9931235909461976
2592,357984133,2020-08-21 06:53:30+00:00,"Merayakan HUT ke-75 RI, PT Wijaya Karya (Persero) Tbk atau Wika menyalurkan bantuan berupa gerobak dagang usaha mikro, kecil dan menengah (UMKM) kepada warga kurang mampu di Kelurahan Cipinang Cempedak, Jakarta Timur  https://t.co/YSdwhFYTMu",neutral,0.9963253140449524
2591,231355136,2020-08-21 06:59:25+00:00,"PAN Jakarta Siapkan 2,2 M untuk Bantu UMKM",neutral,0.9971609115600586
2590,973230634893103105,2020-08-21 08:19:36+00:00,"PAN Jakarta Siapkan 2,2 M untuk Bantu UMKM: ECONOMIC ZONE - Ketua DPW PAN DKI Jakarta Eko Hendro Purnomo atau Eko Patrio (kanan) bersama pengurus DPW PAN DKI Jakarta memberikan keterangan kepada wartawan saat mengelar jumpa pers di Jakarta, Jumat…",neutral,0.9968593120574952
2588,1052798082419580928,2020-08-21 10:53:03+00:00,Dompet Dhuafa dan PT TEP Beri Bantuan Usaha Mandiri untuk 60 UMKM di Jakarta Utara,neutral,0.9961793422698976
2582,78847590,2020-08-22 03:00:00+00:00,Hai #TemanMRT! Masih ada 2 hari lagi nih. Jangan lupa ikutan Challenge #NyamandiMRT untuk dapat hadiah menarik dari @converse_id dan produk lainnya dari UMKM MRT Jakarta  #MRTJakarta #UbahJakarta #LadjoeIndonesiaku,neutral,0.5311148762702942
2581,1444580334,2020-08-22 04:29:10+00:00,Solusi terbaik tanpa merusak  - Saluran air mampet ? -  Saluran air tidak lancar ? -  Pipa tersumbat -  Kamar mandi mampet ? -  Wastafel mampet / wastafel tersumbat ? -  Septic tank mampet / septictank akibat pembalut atau benda keras lainnya . #umkmjakarta #jakarta #dirumahaja,negative,0.9186296463012696
2580,1262582225683374080,2020-08-22 04:30:02+00:00,60 UMKM di Jakarta Disuntik Modal Usaha,neutral,0.9976994395256042
2579,509946051,2020-08-22 04:40:00+00:00,"PAN Jakarta Siapkan Rp2,2 M untuk Bantu UMKM #BangkitdariPandemi #75TahunMerdeka  https://t.co/L9wlTIl9ea",neutral,0.9961414933204652
2577,1610879210,2020-08-22 07:03:14+00:00,#News: 60 Pelaku UMKM di Jakut Terima Bantuan Usaha Mandiri,neutral,0.9971446394920348
2574,1444580334,2020-08-22 13:05:03+00:00,Solusi WC mampet tanpa harus kuras ...   #olshopbekasimurah #rumah #produkunggulan #umkm #umkmindonesia #umkmnaikkelas #umkmjakarta #organik #yogya #yogyakarta #yogyakartacity #yogyakartaistimewa #exploreyogyakarta #sleman #slemansembada #jogja #jogjahits #jogjaistimewa,neutral,0.7853655219078064
2572,734005284713041920,2020-08-23 04:15:04+00:00,"Sandiaga : Saatnya Startup dan UMKM Berinovasi dan Bangkit di Tengah Pandemi: JAKARTA, EDUNEWS.ID-Pengusaha Sandiaga Uno meminta startup &amp; UMKM tidak menyerah dalam menghadapi pandemi virus corona (Covid-19). Dia menilai, sejumlah peluang usaha masih…",neutral,0.9904707670211792
2563,1246073750669291521,2020-08-24 03:36:48+00:00,"Jakarta, Rabu (19/8/2020), manten mengatakan bahwa semua UMKM yang bisa dilakukan ekspornya dibuatkan one day with Coffe and food and cake from Indonesia dis emua benua yang ada di dunia",neutral,0.9650524854660034
2562,516261965,2020-08-24 05:27:35+00:00,Anggota DPRD DKI Jakarta Esti Arimi Putri Ajak Publik Figur Promosikan Produk UMKM  https://t.co/BmuI8lioiI,neutral,0.9964876174926758
2560,166014938,2020-08-25 04:48:14+00:00,KSBB UMKM hadir sebagai program kolaborasi membantu membangkitkan kembali ekonomi kerakyatan di Jakarta. Wadah kolaborasi penyaluran bantuan kewirausahaan untuk UMKM dari masyarakat yang difasilitasi oleh Pemprov DKI Jakarta.  #JakartaSmartCity #JakartaTanggapCorona #KSBB,neutral,0.9796640872955322
2559,166014938,2020-08-25 04:48:18+00:00,"Yuk, jadi bagian pemulihan ekonomi kerakyatan dan bersama-sama ringankan beban UMKM Jakarta melalui KSBB UMKM!  Kunjungi",neutral,0.968995213508606
2558,66602698,2020-08-25 06:29:39+00:00,"Strategi jitu agar UMKM bisa berdaya-saing dalam dinamika ekspor ke mancanegara, adalah dengan menyiapka #SekolahEksporUMKM #goodwork #dagangyuk @kemendag agusuparmanto @ulinyusron @ Jakarta, Indonesia",neutral,0.9697740077972412
2555,259102240,2020-08-25 10:16:35+00:00,JAKARTA - Kementerian Kelautan dan Perikanan (KKP) terus berupaya menjaga geliat Usaha Mikro Kecil dan Menengah (UMKM) di tengah pandemi Covid-19 #MajalahAgrina #Agrina #KKP #EdhyPrabowo #perikanan #Gebyar #Pasar #Laut #Pamerkan #Produk #Unggulan #Olahan  https://t.co/maQKtLxSOe,neutral,0.992570459842682
2552,1610879210,2020-08-25 12:03:09+00:00,#News: Dinas Parekraf-Perguruan Tinggi Gelar Webinar untuk UMKM,neutral,0.995943248271942
2550,18249099,2020-08-25 13:27:43+00:00,Di twitter ini banyak bakulan kuliner kelas UMKM.  UMKM bakulan kuliner yang di Jakarta bagaimana?  Sudah bisa mengadaptasi peraturan Pemda DKI yang berlaku awal Juli 2020 ini?,neutral,0.6828038692474365
2549,18249099,2020-08-25 13:35:28+00:00,"Iya sejak awal Juli ini menurut peraturan Pemda DKI, UMKM di DKI Jakarta harus menyediakan kantong belanja alternatif yang ramah lingkungan.  Ide bagus tapi pada kenyataan di tengah pandemi ini tidak semudah itu penerapannya ya kisanak.",positive,0.5640439391136169
2548,18249099,2020-08-25 13:37:23+00:00,"Hasil riset Katadata terhadap 1.162 pelaku UMKM makanan dan minuman di Jakarta, 91,7% diantaranya mengaku terdampak pandemi Covid-19 dan 56,7% UMKM omsetnya menurun lebih dari 30%.   Lumayan banyak kan?",positive,0.5150478482246399
2547,2787804523,2020-08-25 14:05:33+00:00,"Tidak hanya itu, akan ada juga Seminar Online buat Usaha Mikro, Kecil dan Menengah (UMKM) terkait Strategi Perpajakan di Masa Covid-19. Narasumber dari seminar ini adalah Kepala Bidang P2 Humas Kanwil DJP Jakarta Barat, Fathimati Zahra.",neutral,0.991821587085724
2546,2787804523,2020-08-25 14:05:36+00:00,Acara akan berlangsung Live pukul 09.00-12.00 di Youtube Kanwil DJP Jakarta Barat.  #Pajak #PajakKuatIndonesiaMaju #ukrida #seminaronline #UMKM,neutral,0.9947354197502136
2541,2340155395,2020-08-26 05:08:02+00:00,PAN DKI: Modal untuk UMKM Jadi Solusi Perbaiki Ekonomi Jakarta,neutral,0.9950227737426758
2538,1610879210,2020-08-26 11:03:12+00:00,#News: Puluhan Pelaku UMKM di Kemayoran Ikuti Tes Massal Covid-19,neutral,0.9980220794677734
2537,425217074,2020-08-26 16:20:45+00:00,Mau makan Pempek di Jakarta Asli Ikan Tenggiri yang rasanya seperti pempek di Lampung atau Palembang. Beraso iwaknyo dan cukonyo sedep. Cobain nih Pempek dari @pempelambang dan rasakan bedanya 😁😁 mari bantu UMKM #pempek #pempekjakarta #pempekjaksel,neutral,0.498597264289856
2536,166014938,2020-08-27 12:34:27+00:00,"Selama pandemi Covid-19, #UMKM merupakan kelompok rentan yang paling terdampak dari aspek ekonomi. Pemprov DKI Jakarta mengajakmu ikut bangkitkan kembali ekonomi kerakyatan di Jakarta melalui program #KSBB UMKM.  #JakartaSmartCity #JakartaTanggapCorona #hadapibersama #jagajakarta",neutral,0.958709478378296
2532,66602698,2020-08-29 03:02:38+00:00,"Langkah Strategis Mendorong Kebangkitan UMKM  #bag1   #goodwork #dagangyuk @kemendag agusuparmanto @ulinyusron @ Jakarta, Indonesia",neutral,0.9878045320510864
2531,66602698,2020-08-29 03:04:00+00:00,"Langkah Strategis Mendorong Kebangkitan UMKM  #bag2  #goodwork #dagangyuk @kemendag agusuparmanto @ulinyusron @ Jakarta, Indonesia",neutral,0.9869633316993712
2530,66602698,2020-08-29 03:11:22+00:00,"Langkah Strategis Mendorong Kebangkitan UMKM  #bag2  #goodwork #dagangyuk @kemendag agusuparmanto @ulinyusron @ Jakarta, Indonesia",neutral,0.9869633316993712
2529,259102240,2020-08-29 22:20:47+00:00,"JAKARTA - Sejalan dengan gerakan nasional Bangga Buatan Indonesia yang tengah digencarkan oleh pemerintah, Kementerian Kelautan dan Perikanan (KKP) mendorong UMKM sektor kelautan dan perikanan #MajalahAgrina #Agrina #KKP #UMKM #PERIKANAN #E_COMMERCE  https://t.co/7fdZFTMLng",neutral,0.9926669001579284
2525,166409409,2020-08-30 17:10:32+00:00,"Saya hadir dalam acara Sosialisasi Kowani Fair bersama Tokopedia... . Time: Aug 28, 2020 10:00 AM Jakarta . Jangan lupa yah temen-temen kita bantu pemasaran UMKM yah dengan ikutan belanja di KOWANI FAIR yang tahun…",neutral,0.9370526671409608
2524,1049694745595863040,2020-08-30 17:26:10+00:00,Kripik kentang Abang  Dari kentang pilihan  Tampa MSG  Tampa micin  Dan renyah  #kripik #indonesia  #jakarta #umkm #halal #kripikkentangabang  #snack,positive,0.938307523727417
2523,180696019,2020-08-30 23:43:49+00:00,"Simak #TalkshowSonora  @pertamina UMKM On Air  ""Pertamina SMEXPO 2020 Menjadi Fasilitator UMKM Indonesia dan Mitra  Binaan""   Pk. 09.00-10.00 wib  Di Sonora FM 92 Jakarta &amp; #SonoraNetwork   Interaktif SMS/WA: 0812.112.9200",neutral,0.9897729754447936
2522,180696019,2020-08-31 00:00:05+00:00,"Simak #TalkshowSonora  @pertamina UMKM On Air  ""Pertamina SMEXPO 2020 Menjadi Fasilitator UMKM Indonesia dan Mitra  Binaan""   Pk. 09.00-10.00 wib  Di Sonora FM 92 Jakarta &amp; #SonoraNetwork   Interaktif SMS/WA: 0812.112.9200",neutral,0.9897729754447936
2521,180696019,2020-08-31 00:30:02+00:00,"Simak #TalkshowSonora  @pertamina UMKM On Air  ""Pertamina SMEXPO 2020 Menjadi Fasilitator UMKM Indonesia dan Mitra  Binaan""   Pk. 09.00-10.00 wib  Di Sonora FM 92 Jakarta &amp; #SonoraNetwork   Interaktif SMS/WA: 0812.112.9200",neutral,0.9897729754447936
2519,180696019,2020-08-31 01:00:10+00:00,"Simak #TalkshowSonora  @pertamina UMKM On Air  ""Pertamina SMEXPO 2020 Menjadi Fasilitator UMKM Indonesia dan Mitra  Binaan""   Pk. 09.00-10.00 wib  Di Sonora FM 92 Jakarta &amp; #SonoraNetwork   Interaktif SMS/WA: 0812.112.9200",neutral,0.9897729754447936
2518,180696019,2020-08-31 01:30:02+00:00,"Simak #TalkshowSonora  @pertamina UMKM On Air  ""Pertamina SMEXPO 2020 Menjadi Fasilitator UMKM Indonesia dan Mitra  Binaan""   Pk. 09.00-10.00 wib  Di Sonora FM 92 Jakarta &amp; #SonoraNetwork   Interaktif SMS/WA: 0812.112.9200",neutral,0.9897729754447936
2517,180696019,2020-08-31 01:45:01+00:00,"Simak #TalkshowSonora  @pertamina UMKM On Air  ""Pertamina SMEXPO 2020 Menjadi Fasilitator UMKM Indonesia dan Mitra  Binaan""   Pk. 09.00-10.00 wib  Di Sonora FM 92 Jakarta &amp; #SonoraNetwork   Interaktif SMS/WA: 0812.112.9200",neutral,0.9897729754447936
