,user_id,date,content_2,sentiment_label,sentiment_score
1272,927438599745806338,2021-03-31 12:34:57+00:00,"https://t.co/rzVE3t7vcU  Pagi ini di Kompleks Parlemen, Senayan, Jakarta, Selasa (30/3), kami melaksanakan Rapat kerja terkait membahas holding UMKM tahun 2021.",neutral,0.9970178604125975
1264,104446991,2021-04-01 05:52:10+00:00,"Vaksinasi massal untuk pelaku UMKM digelar di Ciputra Artpreneur Museum, Jakarta, Kamis (1/4). Sebanyak 1.500 pelaku UMKM menerima vaksin COVID-19 dosis pertama",neutral,0.9969565868377686
1261,118646322,2021-04-01 08:57:05+00:00,"Resmi Dibuka, Pelaku UMKM DKI Jakarta Kini Bisa Lakukan Vaksinasi",neutral,0.9975528120994568
1258,552523769,2021-04-01 09:57:54+00:00,"Kemenkop UKM menyelenggarakan vaksinasi COVID-19 massal bagi 1.500 pelaku UMKM di Ciputra Artpreneur, Jakarta Selatan, Kamis (1/4). Berikut potretnya. #Foto  https://t.co/LWxXTRe1ju",neutral,0.9969035983085632
1257,1294472490274627584,2021-04-01 10:53:38+00:00,"@iniakuitis @GodD4mn1t @SatriaUmbara9 @PXelfi2 @SemutMe80 Pempek, DKI Jakarta  DUKUNG UMKM DAN PRODUK DALAM.NEGERI",neutral,0.9499688744544984
1252,2978883793,2021-04-02 08:00:00+00:00,"Yuk ikutan sharing session yang akan dibawakan oleh Chef Andrian Ishak, Owner dari Namaaz Dining, dan Kevin dan Torana, Founder Foto Produk Jakarta.  Jangan sampai terlewat ya: Sabtu, 3 April 2021 Pukul 08:00-12:00 WIB Via zoom  #umkm #business #BusinessOwner #businesstips",neutral,0.9493856430053712
1248,3271146871,2021-04-03 09:00:01+00:00,"Rangkaian foto berikut memperlihatkan masyarakat setempat yang tengah menerima suntikan vaksin COVID-19 dalam program vaksinasi massal untuk pekerja usaha mikro, kecil, dan menengah (UMKM) di DKI Jakarta, Kamis (1/4)",neutral,0.9961469173431396
1246,274636630,2021-04-04 03:40:36+00:00,"Implementasi Technopreneur Dalam Membangkitkan UMKM di Indonesia Sabtu, 24 April 2021, 09.00-11.00 WIB  Pembicara 1. Bari Arijono,",neutral,0.994698166847229
1245,1088144288,2021-04-04 11:19:08+00:00,Pelaku UMKM monitor... Demokrat Jakarta siap support nih 👌,neutral,0.980467677116394
1244,743319071559606273,2021-04-04 23:23:23+00:00,"Bazar online Jakarta Utara,  Bela negara masa kini ya beli produk-produk UMKM  @aniesbaswedan @DKIJakarta @ArizaPatria",neutral,0.9830281734466552
1243,135795460,2021-04-05 10:59:35+00:00,Webinar tentang Sinergi Bank Mandiri - Pertamina digelar di Jakarta. Bank Mandiri dan Pertamina bersinergi memberdayaan UMKM melalui program Mitra Pertashop.,neutral,0.9863778352737428
1242,260686783,2021-04-05 23:10:00+00:00,"Kawan Kabinet, simak yuk arahan Presiden @jokowi mengenai peningkatan rasio kredit untuk UMKM, yang disampaikan oleh Menko Perekonomian @airlangga_hrt dalam keterangan pers usai rapat yang dipimpin oleh Presiden, Senin (05/04/2021), di Jakarta.  #SidangKabinet",neutral,0.9968300461769104
1240,743319071559606273,2021-04-07 04:56:48+00:00,Berikut laporan total penjualan bazaar online yang diselenggarakan oleh Sudin PPKUKM Jakarta Utara.   Yuk kita terus dukung UMKM DKI Jakarta dengan membeli produk-produknya.   @aniesbaswedan @ArizaPatria @DKIJakarta,neutral,0.8747599124908447
1237,166014938,2021-04-07 23:36:22+00:00,"@AtikahBabe Di Pemprov DKI Jakarta terdapat program Jakpreneur, yaitu program pemberdayaan para usaha umkm, dan didalam program (terdiri dari 7 tahapan) tersebut terdapat salah satu tahapan yaitu bantuan permodalan dari bank (tahapan paling terakhir). (2)",neutral,0.9583913683891296
1234,2783746813,2021-04-09 03:52:51+00:00,"Sementara itu, Direktur Riset CORE Indonesia Piter Abdullah menilai pelaku usaha, khususnya UMKM, harus menyiapkan profil risiko untuk memperoleh kemudahan kredit dari perbankan.  Via : Koran Jakarta  https://t.co/kiUIBLAVO1",neutral,0.9962117671966552
1231,3878060182,2021-04-09 14:59:23+00:00,"Warga Jakarta,bersiap nih moga ada dampak positif dr adanya larangan mudik, asal betul betul diterapkan &amp; warga taat aturan. salah satu dampak positifnya adalah wisata jakarta rame, mall rame, makom rame, umkm rame asal 1 hal, Rame-rame taat prokes , 3 M @aniesbaswedan",positive,0.9130074381828308
1229,154102750,2021-04-11 06:10:20+00:00,"Subsidi Ongkir Harbolnas Diharapkan Bantu UMKM Luar Jakarta, Bukan Impor",neutral,0.9941658973693848
1228,238091066,2021-04-11 07:13:15+00:00,Subsidi Ongkir Harbolnas Ramadan Diharapkan Bantu UMKM Luar Jakarta,neutral,0.991738736629486
1227,1610879210,2021-04-11 08:03:45+00:00,#News: 4.825 Pelaku UMKM Sudah Divaksin COVID-19 Dosis Pertama,neutral,0.9979323148727416
1226,1315962283361591296,2021-04-12 00:51:16+00:00,"Assalamualaikum, selamat pagi temen2 UMKM Jakarta yg dr kemarin resah blom dpt BPUM bs meluncur ke link2 berikut untuk pendaftaran ya. Form dibuka Jam 8-3 sore.   Sumber valid dr:",neutral,0.9959836006164552
1223,166596650,2021-04-12 03:49:23+00:00,Rapat dgn Direktorat Jenderal Kekayaan Intelektual Kemenkumham utk Memberikan Edukasi kpd UMKM. #Syahnan Phalipi. #Management Legal Specialist. $Ketua Umum Founder DPP HIPMIKINDO #CEO Fokus Lawyer International. #Wakil Ketua DEKOPIN Jakarta.,neutral,0.9950242638587952
1222,1369574670991716352,2021-04-12 03:58:02+00:00,Selamat berbisnis!  #jasapendirianperusahaan #jasasertifikatiso #sertifikatiso #jasalegalitas #jasapembuatanwebsite #jasaseo #jasaefilingpajak #jasaoss #jasaperpajakan #pelaporanpajak #virtualoffice #website #searchengineoptimization #jasapendirianptmurah #covid19 #jakarta #umkm,neutral,0.8839698433876038
1219,41730943,2021-04-12 07:53:03+00:00,Bakrie Amanah Sumbang Dana Bagi UMKM Binaan Kadin DKI Jakarta,neutral,0.9957095384597778
1216,732087001600548864,2021-04-12 11:27:14+00:00,"Tingkatkan UMKM, LaNyalla Dukung Kerja Sama dengan HIPMIKINDO   JAKARTA-Ketua DPD RI AA LaNyalla Mahmud Mattalitti menyambut baik usulan kerja sama DPD RI dan Himpunan Pengusaha Mikro,   @LaNyallaMM1 @DPDRI #LaNyalla #LaNyallaAcademia #umkm",neutral,0.9749496579170228
1215,732087001600548864,2021-04-12 11:27:17+00:00,"Saya setuju kerja sama antara HIPMIKINDO dengan DPD RI. Saya juga mendukung visi dan misi HIPMIKINDO untuk memajukan UMKM di seluruh Indonesia,” ucap LaNyalla saat audiensi dengan HIPMIKINDO di Nusantara III Komplek Parlemen, Jakarta, Senin (12/4).   #LaNyalla #LaNyallaAcademia",neutral,0.9516289234161376
1208,977751401051799552,2021-04-14 09:11:39+00:00,"Anies Baswedan: 60% Ekonomi DKI Ditopang Konsumsi, Perlu Perbaikan Kesehatan-UMKM https://t.co/ZtfEx0AJt8  @aniesbaswedan mendorong pemulihan ekonomi Jakarta salah satunya dengan perbaikan di sektor ekonomi mikro.  View LIVE❗ https://t.co/xxs0XTa2QS",neutral,0.9921159148216248
1205,1127831192,2021-04-14 23:07:59+00:00,Cara Daftar BPUM 2021 Online di Jakarta &amp; Link Pendaftaran BLT UMKM -,neutral,0.9973540306091307
1204,196208994,2021-04-15 02:00:01+00:00,BRIGHTWELL Photo &amp; Video   more info : WA: 0878-2240-1343 follow ig @ bwellphotovideo   #fotomakanan #fotoproduk #tokopedia #bukalapak #grabfood #gofood #jaksel #jakbar #jaktim #jakpus #jakut #depok #tangsel #jakarta #umkm #bisnisrumahan #bisnis #pengusaha,neutral,0.9753651022911072
1201,869542517057798144,2021-04-15 09:32:08+00:00,"@RD_4WR1212 DP 0% sukses 100%, jakarta tidak pernah lg banjir sejak anies jadi gubernur, umkm sdh dimodali dan dicarikan pembeli, macet tuntas teratasi..   Tapi..... bo'oooong.... 🤣🤣",negative,0.8741651773452759
1200,1019458682738757632,2021-04-15 10:34:04+00:00,"BLT UMKM Rp1,2 Juta DKI Jakarta Dibuka, Cek Link Pendaftarannya di Sini! -",neutral,0.9973114728927612
1195,76351840,2021-04-16 16:23:27+00:00,@gofoodindonesia Minta daftar UMKM @gofoodindonesia paling populer di Jakarta dunk min. Pengen wisata kuliner sehat di rumah,positive,0.8443570733070374
1194,927438599745806338,2021-04-17 09:18:17+00:00,"Hari kedua menemui pelaku umkm di papanggo, kalibaru, semper barat dan timur jakarta utara. Ada banyak cerita sukaduka UMKM masa Pandemi. Eh dapat ernergi baru dari DR  @RamliRizal. Thanks i m froud of u.",positive,0.933506727218628
1192,1292422530901274625,2021-04-18 08:53:28+00:00,JAKARTA UPDATE: 30 UMKM Lubang Buaya Ramaikan Bazaar di TMII,neutral,0.991965651512146
1191,948421189,2021-04-18 09:10:13+00:00,"Resmi dilantik, MES DKI Jakarta Siap Dukung Pengembangan UMKM Berbasis Syariah",neutral,0.9884554147720336
1190,1610879210,2021-04-18 10:03:32+00:00,#News: 30 UMKM Lubang Buaya Ramaikan Bazaar di TMII,neutral,0.9904553294181824
1188,46693036,2021-04-18 12:15:02+00:00,MES DKI Jakarta Siap Dukung UMKM Berbasis Syariah,neutral,0.9680354595184326
1186,977870468,2021-04-19 06:38:07+00:00,"Langsung ke lokasi UMKM di Jakarta Selatan, Alhamdulillaah langsung lihat produksi, langsung beli dan In Syaa Allah kalau ada yg mau mampir ke Kantor DPD RI Dapil DKI Jakarta, In Syaa Allah disediain Bir Pletok asli Betawi bang Isra dari Mpok Sylvi🧡🙏  #sylvianamurni  #dpdri",neutral,0.7817344069480896
1184,98275340,2021-04-19 08:16:30+00:00,Warga DKI Jakarta yang UMKM sudah mulai divaksin hari ini. Alhamdulillah,neutral,0.5581137537956238
1183,438017429,2021-04-19 09:27:28+00:00,"@NasDem DKI Jakarta membentuk tim penyuluhan UMKM yg bertujuan mempermudah para pelaku UMKM dlm mengembangkan usaha, mendapatkan bantuan dari program pemerintah baik itu permodalan, juga pelatihan digital marketing.  #PartaiNasdem #NasdemDKIJakarta #UMKM #NasdemPeduli",neutral,0.9950326681137084
1176,1199908810124488710,2021-04-20 05:14:19+00:00,"Warga Jakarta? Manfaatkan BLT UMKM, Ayo Cek Link Pendaftarannya | Konfirmasi Times",neutral,0.9979456067085266
1174,1343578945518592000,2021-04-20 05:33:06+00:00,Klik di Sini Link untuk Pendaftaran BLT UMKM Per Kecamatan di Wilayah DKI Jakarta,neutral,0.9973264932632446
1173,1019458682738757632,2021-04-20 06:56:52+00:00,"Syarat, Cara, &amp; Link Pendaftaran BPUM atau BLT UMKM 2021 di Jakarta: Simak, Biar Lolos Seleksi! -",neutral,0.9966578483581544
1172,1123229679484190721,2021-04-20 09:46:01+00:00,Saya menjual Ikan Nila Merah Premium Quality (Frozen) dari Subang seharga Rp35.000. Ayo beli di Shopee! ➡️https://t.co/Y2PLS7qelN  #food #Jakarta #Indonesia #umkm #contentmarketing #DigitalMarketing #tuesdaymotivations #tuesdayvibe #smallstreamer #SmallStreamersConnect #FolloMe,neutral,0.973252773284912
1170,23343960,2021-04-20 15:57:04+00:00,"“Kami di Pemprov DKI Jakarta telah melakukan berbagai upaya untuk meningkatkan kembali geliat sektor UMKM,"" kata Asisten Perekonomian dan Keuangan DKI",neutral,0.9561059474945068
1165,1610879210,2021-04-21 07:04:08+00:00,#News: Kolaborasi Pemprov DKI dan APPBI Gelar Vaksinasi COVID-19 Bagi Pelaku UMKM,neutral,0.9970519542694092
1163,2714869507,2021-04-21 13:29:00+00:00,11 mal di Jakarta telah jadi sentra vaksinasi untuk pelaku UMKM.  #merahputihcom #vaksinasiumkm #umkm #vaksinasicovid19 #sentravaksinasi  https://t.co/i9EHNWcHY7,neutral,0.9942646622657776
1161,754553665,2021-04-22 01:44:37+00:00,Saya menjual Ikan Nila Merah Premium Quality (Frozen) dari Subang seharga Rp35.000. Ayo beli di Shopee! ➡️https://t.co/hmgyhfUWWR  #fish #food #halal #umkm #thursdaymorning #DigitalMarketing #market #Share #jakarta #MotivationalQuotes #FolloMe #follotrick #SmallStreamersConnect,neutral,0.9596843123435974
1160,754553665,2021-04-22 01:51:52+00:00,"Beli Ikan Nila Merah Premium Quality (Frozen) dari Subang  https://t.co/S7PJIlxqzK di toko enihardi Rp35.000 di Tokopedia, Sekarang!  #Tokopedia #food #fish #thursdaymorning #SmallStreamersConnect #healthy #halal #umkm #jakarta #folloMe #follotrick #Viral #Trending",neutral,0.9646210670471193
1144,118646322,2021-04-22 12:15:34+00:00,"Link Pendaftaran BLT UMKM Rp1,2 Juta di Seluruh Kecamatan DKI Jakarta",neutral,0.9978012442588806
1142,2340155395,2021-04-22 13:06:04+00:00,"Berikut ini link Pendaftaran BLT UMKM tahun 2021 untuk wilayah Jakarta. Pelaku UMKM yang lolos akan menerima bantuan sebesar Rp 1,2 juta.",neutral,0.9954763054847716
1141,1385159066171838470,2021-04-22 16:54:26+00:00,"JAKARTA,",neutral,0.9884496927261353
1140,1127831192,2021-04-22 17:38:44+00:00,"Daftar Link Pendaftaran BLT UMKM Rp 1,2 Juta di Seluruh Kecamatan di DKI Jakarta https://t.co/8nBO2WbPqS",neutral,0.9974763989448548
1139,1123229679484190721,2021-04-23 01:53:43+00:00,"Beli Ikan Nila Merah Premium Quality (Frozen) dari Subang  https://t.co/1tkIE1avIA di toko enihardi Rp35.000 di Tokopedia, Sekarang!  #TokopediaWIB #Online #shopping #OnlineMarketing #Digital #marketing  #SmallBiz #SmallStreamersConnect #umkm #jakarta #Indonesia #FolloMe",neutral,0.9827211499214172
1138,166596650,2021-04-23 02:14:39+00:00,"Kolaborasi Kerjasama Sinergi HIPMIKINDO,Kemenkop UKM, Koperasi Janusa, easybiz utk meningkatkan akses keuangan UMKM&amp;Koperasi #Syahnan Phalipi Co #Management Legal Specialist #Ketum HIPMIKINDO #CEO Fokus Lawyer International #Wkl Ketua Dekopin Jakarta",neutral,0.9897825717926024
1132,1347039347346821120,2021-04-25 12:34:59+00:00,"@hwi_wijaya_ke2 Yang perempuan sebagai Kartini masa kini, Yth. Bunda @MercyZheng dan yang kedua Pahlawan UMKM Indonesia Yth. Babeh @babegalak1.  #Abah sarungnya bisa dikirim ke jln. Bandengan Utara, Penjaringan Jakarta Utara.  Semoga berkah untuk semuanya.....🤲",neutral,0.8374586701393127
1126,166596650,2021-04-26 03:09:22+00:00,Crowdfunding alternatif pembiayaan utk pebisnis UMKM &amp; koperasi sila gabung #Syahnan Phalipi Co #Management Legal Specialist #Ketum HIPMIKINDO #CEO Fokus Lawyer International #Wakil Ketua Dekopin Jakarta,neutral,0.9945896863937378
1125,734005284713041920,2021-04-26 10:26:07+00:00,"Untuk Tetap Eksis, UMKM Harus Bertransformasi ke Digital: JAKARTA, EDUNEWS.ID-Era globalisasi saat ini, persaingan pasar kerja semakin ketat, Pelaku UMKM di Indonesia memiliki beberapa permasalahan, seperti: bidang manajemen, organisasi, teknologi,…",neutral,0.97554612159729
1122,1349779426653818881,2021-04-27 06:20:14+00:00,"Hai #KawanJakita, ada gerai UMKM di Terowongan Kendal, Jakarta Pusat lho! Di gerai UMKM ini, kamu akan dilayani oleh pekerja penyandang disabilitas. Ada makanan dan minuman disana. Simak potret suasana gerai UMKM tersebut di",neutral,0.8516156077384949
1119,1384529798827962368,2021-04-27 13:47:25+00:00,"Webinar dengan Tema *_“Pentingnya Digitalisasi UMKM untuk Meningkatkan Daya Saing""_* yang akan diselenggarakan pada: 📆 Rabu, 28 April 2021 ⏰ 09.00 - 12.00 WIB Link Zoom: https://t.co/Ypcj1LybD3 Meeting ID: 950 6896 0507 Passcode: 211309 #kadin_jakarta #jcci #kadinjakarta",neutral,0.9801908731460572
1118,733349770392047616,2021-04-27 15:01:14+00:00,@hwi_wijaya_ke2 Yang Perempuan pasti my Wonder Woman si Cici @MercyZheng yg kmrn jd promotor liga riweh 😹.   Yang lelaki itu pasti my great leader si Maurinho wkwkwk @babegalak1 sang pencetus UMKM angkringan utk maju dan Jaya selalu.   Kedua org yg hebat dan suka berbagi.  #Abah  Jakarta Pusat,positive,0.9708538055419922
1116,91255162,2021-04-27 23:14:21+00:00,"Silaturahmi dengan Kantor Perwakilan BI DKI Jakarta, Anis Bahas Pemberdayaan UMKM",neutral,0.9962252378463744
1113,927438599745806338,2021-04-28 02:59:18+00:00,"Kamis 20/4, kami bersama Bank Indonesia dan pak Yani Wahyu Purwoko, Wakil Walikota Jakarta Barat melakukan sosialisasi dan edukasi #QRIS kepada 75 peserta umkm dengan tema ""Fintech Bagi Pelaku Usaha Mikro Kecil &amp; Menengah dan Silaturahmi Dialog Ramadhan"".  https://t.co/2HuwDrS1f2",neutral,0.990794003009796
1108,4329003615,2021-04-28 10:32:43+00:00,Siapa sangka UMKM akan menjadi faktor penentu dari pemulihan ekonomi di DKI Jakarta?  #SinergiBarengBangunJakarta,neutral,0.8599725961685181
1107,4329003615,2021-04-28 10:32:48+00:00,"Karena faktanya sebesar 94% pelaku usaha yang ada di Jakarta berbentuk UMKM. Wah, kecil-kecil kalau banyak besar pengaruhnya juga ya 🐜🐜  Yuk sama-sama kita dukung UMKM sebagai upaya pemulihan perekonomian kita!",negative,0.4013458490371704
1104,162616582,2021-04-28 17:12:56+00:00,@SovianCalm @o_wiratama @Luz_AP @beyezig @Bacartio @nabiylarisfa @aishazzahra pantes banget mas!  masalahnyaaa layaknya semana dulu 😂 kalo pengusaha umkm cuma dapet 15 juta perbulan (kotor) terus ente minta digaji umr jakarta ga pantes lah 😅,negative,0.97041118144989
1103,238091066,2021-04-28 18:09:50+00:00,ITC Mangga Dua Menjadi Sentra Vaksin bagi 15.000 Pelaku UMKM di Jakarta   ,neutral,0.9954738020896912
1102,166596650,2021-04-28 22:53:40+00:00,Petemuan rutin dgn seketaris Menteri Koperasi UKM Arif Rahman dgn Syahnan Phalipi Ketum HIPMIKINDO&amp;kedua team utk memberikan masukan terkini ttg UMKM&amp;Koperasi smg Ekonomi Indonesia sgr pulih. #Syahnan Phalipi #Ketum Hipmikindo #Wkl Ketua DEKOPIN Jakarta,neutral,0.9810742735862732
1101,88593647,2021-04-29 06:28:36+00:00,"Plus Enam Dua akan menggelar event hybrid sneakers di Mall of Indonesia, Jakarta pada 29 April - 2 Mei 2021. Event tersebut nantinya akan diikuti lebih dari 45 tenant yang terdiri dari 30 persen merk internasional dan 70 persen UMKM. #UMKM #Sneakers   https://t.co/s7KRVxgiBJ",neutral,0.9781078696250916
1100,177084452,2021-04-29 07:45:00+00:00,"Sebanyak 60 UMKM akan mengikuti bazar bertema Ramadhan Fest di Mall Grand Indonesia, Jakarta Pusat, pada 1-9 Mei 2021 mendatang.  Acara bazar itu digelar oleh Pemerintah Kota Jakarta Pusat guna mendorong ekonomi masyarakat di tengah pandemi Covid-19.  #SmartNews @kompascom",neutral,0.9747242927551271
1099,1190086793250529280,2021-04-29 11:34:23+00:00,"@PDI_Perjuangan 🇧‌🇺‌🇱‌🇦‌🇳‌ 🅝🅐🅝 🅟🅔🅝🅤🅗 🅑🅔🅡🅚🅐🅗, Anggt @DPR_RI Bpk @DuriantoDarmadi 🅱🅴🆁🅶🅴🆁🅰🅺 ke #Sunter, #Jakut membagikan #Gerobak #Usaha kpd pelaku #UMKM   #PDIPerjuangan  #darmadidurianto  @bumegabercerita  @66Hasto  @puanmaharaniri  @fpdip_jakarta",neutral,0.9881969094276428
1097,3079723462,2021-04-30 09:28:37+00:00,Acara ini akan berlangsung mulai Sabtu (1/5) sampai dengan Minggu (9/5) nanti. Kalian bisa dapatkan berbagai produk keren dari UMKM binaan Jakpreneur di wilayah Jakarta Pusat. @aniesbaswedan @ArizaPatria @walikotajakpus @DKIJakarta  #infojakpus #Ramadhan,neutral,0.7765862941741943
1096,743319071559606273,2021-04-30 21:52:53+00:00,Bazar Festival Ramadhan diselenggarakan oleh Suku Dinas PPKUKM Jakarta Barat berkolaborasi dengan Lippo Mall Puri.  Acara dimulai dari tanggal 1 Mei-9 Mei 2021.   Akan ada banyak UMKM Binaan Dinas PPKUKM / Jakpreneur yang akan bergabung  @aniesbaswedan @ArizaPatria @KUKMPDKIJKT,neutral,0.8505368828773499
1095,743319071559606273,2021-04-30 21:54:13+00:00,Bazar Festival Ramadhan diselenggarakan oleh Suku Dinas PPKUKM Jakarta Pusat berkolaborasi dengan Grand Indonesia Mall  Acara dimulai dari tanggal 1 Mei-9 Mei 2021  Akan ada banyak UMKM Binaan Dinas PPKUKM / Jakpreneur yang akan bergabung  @aniesbaswedan @ArizaPatria @DKIJakarta,neutral,0.9480336904525756
1093,743319071559606273,2021-05-01 03:54:50+00:00,Bazar Festival Ramadhan diselenggarakan oleh Suku Dinas PPKUKM Jakarta Utara berkolaborasi dengan Mall Artha Gading  Acara dimulai dari tanggal 1 Mei-9 Mei 2021  Akan ada banyak UMKM Binaan Dinas PPKUKM / Jakpreneur yang akan bergabung  @DKIJakarta @aniesbaswedan @ArizaPatria,neutral,0.918338418006897
1092,78847590,2021-05-01 05:24:27+00:00,"#TemanMRT, yuk jalan-jalan ke Bazar Ramadan MRT Jakarta yang akan hadir di Stasiun Lebak Bulus Grab mulai tanggal 1 Mei pukul 15.00-20.00 WIB.  Di Bazar ini, kamu bisa nikmatin berbagai macam produk dan jajanan UMKM. Jangan lupa untuk tetap menerapkan protokol kesehatan, ya!",positive,0.8055489063262941
1089,743319071559606273,2021-05-01 15:22:28+00:00,"Bazar Festival Ramadhan diselenggarakan oleh Suku Dinas PPKUKM Jakarta Timur berkolaborasi dengan Basura Mall dan Cibubur junction  Acara dimulai dari tanggal 1 Mei-9 Mei 2021.   Akan ada banyak UMKM Binaan Dinas PPKUKM, so tunggu apalagi  @aniesbaswedan @ArizaPatria @KUKMPDKIJKT",positive,0.5106332302093506
1088,207559187,2021-05-02 10:29:05+00:00,"Pasar Tanah Abang tidak hanya didatangi warga Jakarta saja, tetapi juga warga Bodetabek dan daerah luar Jakarta lainnya. Denyut ekonomi UMKM ada disana",positive,0.9107207655906676
1085,147063992,2021-05-03 00:31:59+00:00,"Mau belanja lebaran? Jangan ke Tanah Abang semua dong. Penuh. Nih ke Bazzar Ramadhan Jakpreneur saja. Stasiun MRT Lebak Bulus, Mall Basura, Mall GI Skybridge (East Mall), Mall Artha Gading (sisi kanan atrium nusantara lt 1).  Belanja aman, sambil mdukung UMKM Jakarta. Tetap 3 M.",positive,0.9006796479225159
1084,743319071559606273,2021-05-03 01:21:06+00:00,LOGO REVEAL!  Hitung mundur menuju festival yang sudah ditunggu-tunggu kita semua terutama pelaku UMKM DKI Jakarta @jakpreneur  @aniesbaswedan @ArizaPatria @DKIJakarta,neutral,0.9890138506889344
1083,743319071559606273,2021-05-03 05:14:02+00:00,"Yuuuk, datang dan ramaikan Acara BAZAR UMKM Tingkat Kota Jakarta Timur yang diselenggarakan oleh Suku Dinas PPKUKM Kota Administrasi Jakarta Timur, pada: 🗓️ 3-4 Mei 2021 🕛 08.00 - 15.00 📌 Area Parkir Kantor Walikota Kota Administrasi Jakarta Timur  #umkm #umkmindonesia #bazar",neutral,0.9809108972549438
1080,3079723462,2021-05-03 07:34:12+00:00,"Kepala Suku Dinas Kesehatan Kota Administrasi Jakarta Pusat, Erizon Safari menjelaskan vaksinasi ini diperuntukan untuk pelaku UMKM dan pedagang.  “Untuk di Thamrin City dan Grand Indonesia masing-masing dibantu oleh 25 tenaga kesehatan.",neutral,0.9933912754058838
1079,732087001600548864,2021-05-03 07:34:20+00:00,"JAKARTA - Ketua DPD RI, AA LaNyalla Mahmud Mattalitti, mendukung Otoritas Jasa Keuangan (OJK) yang sedang mengkaji penghapusan kredit bermasalah atau write off kredit usaha mikro kecil menengah (UMKM) di bawah Rp 5 miliar. #LaNyalla #LaNyallaAcademia",neutral,0.9965730905532836
1078,1610879210,2021-05-03 10:03:22+00:00,#News: 100 Produk UMKM Ramaikan E-Baz Sudin PPAPP Jakbar,neutral,0.9961997866630554
1075,1384529798827962368,2021-05-03 15:00:22+00:00,"Pelaku UMKM dapat mendaftarkan diri untuk pelaksanaan Vaksin COVID-19, untuk mempercepat terciptanya kekebalan kelompok #kadin #kadin_jakarta #kadinjakarta",neutral,0.9975027441978456
1067,135795460,2021-05-04 01:37:08+00:00,Para pelaku Usaha Mikro Kecil dan Menengah (UMKM) dan pekerja ritel vaksinasi di 5 mal di Jakarta.,neutral,0.9976052045822144
1066,1369574670991716352,2021-05-04 05:41:39+00:00,"UU Cipta Kerja mendukung UMKM!   #umkmbangkit @ Jakarta, Indonesia",neutral,0.9976045489311218
1059,177084452,2021-05-05 06:15:00+00:00,"Kapolres Metro Jakarta Selatan Kombes Azis Andriansyah mengatakan, konser musik di Cibis Park, Cilandak Timur, Pasar Minggu, Jakarta Selatan, tak berizin.  Azis menegaskan, izin awal yang disampaikan oleh penyelenggara adalah kegiatan bazar UMKM.  #SmartNews @kompascom",neutral,0.9927104711532592
1058,1066660847156490241,2021-05-05 08:46:37+00:00,"Bangkitkan Usaha Kecil Mikro Menengah (UMKM), MRT Jakarta Gelar Bazar Ramadan",neutral,0.9924615025520324
1056,1123229679484190721,2021-05-05 13:37:21+00:00,Saya menjual Pepes Ikan Mas Duri Lunak (Frozen) seharga Rp50.000. Ayo beli di Shopee!,neutral,0.9641304612159728
1053,3105706622,2021-05-06 01:23:38+00:00,5. Layanan Pengaduan Konsumen  Untuk pertama kalinya  KERLING JAKARTA melaksanakan kegiatan di kantor Walikota Jakarta Timur pada tanggal 3-4 Mei 2021. KERLING JAKARTA hadir pada bazar UMKM yang digelar pemerintah kota administrasi Jakarta Timur.,neutral,0.9904965162277222
1052,3105706622,2021-05-06 01:23:38+00:00,KERLING JAKARTA mendapat sambutan yang sangat baik dari Pemerintah Kota Jakarta Timur dan Pelaku Usaha yang datang ke lokasi bazar yang bertempat di halaman kantor walikota Jakarta Timur. Hadir selama 2 hari membantu UMKM binaan pemerintah daerah Jakarta Timur,positive,0.9194358587265016
1051,3105706622,2021-05-06 01:23:39+00:00,untuk mendapatkan ijin edar produk. Produk yang banyak diajukan oleh UMKM pada pelayanan perdana ini adalah produk pangan.  Kehadiran KERLING JAKARTA yang pertama ini didahului dengan audiensi kepada Walikota Jakarta Timur. Walikota berharap kegiatan ini didukung OPD terkait,neutral,0.9358355402946472
1050,754553665,2021-05-06 01:29:53+00:00,Tolong Pak @ArizaPatria di kaji ulang jangan 2 hari kek nutup jalannya Sehari cukuplah.. or kerjasama marketplace kek.. or sama expedisi biar ga kumpulin warga.  #pemprovdki #jakarta #bazarramadhan #Online #umkm #smallbusiness,neutral,0.9009190797805786
1049,280476743,2021-05-06 10:05:55+00:00,"Dear Maya Friends,  Mayapada Hospital bekerja sama dengan Central Park &amp; Neo Soho melakukan layanan vaksinasi covid-19 untuk para pekerja pusat belanja dan retail (Hanya untuk UMKM yang terdaftar dari data dinas PPKUKM DKI Jakarta) pada tanggal : 7, 8, &amp; 10 Mei 2021  Salam sehat",neutral,0.9486863017082214
1048,1291006448344809473,2021-05-06 10:35:30+00:00,@PartaiSocmed Boleh dong mampir ke M Bloc Market yang di Jakarta Selatan kalau mau belanja produk UMKM lokal ✨✨✨,neutral,0.8272966146469116
1047,3079723462,2021-05-06 11:40:52+00:00,Selain berbelanja di POS JP kalian juga sudah berhasil membantu UMKM di Indonesia khususnya Jakarta Pusat loh sahabat !!!   Yuk majukan UMKM di Jakarta. Semoga puasa kamu lancar dan bisa mendatangkan berkah ya !,positive,0.979373574256897
1045,1029961547177574400,2021-05-07 02:00:00+00:00,MRT Jakarta Gelar Bazar Ramadan Libatkan UMKM untuk Bantu Masyarakat  https://t.co/cWWCDK9G6l via @mnews_id,neutral,0.9968497157096864
1041,280476743,2021-05-08 03:00:06+00:00,"Dear Maya Friends,  Mayapada Hospital bekerja sama dengan Pacific Place Mall melakukan layanan vaksinasi covid-19 untuk para pekerja pusat belanja dan retail (Hanya untuk UMKM yang terdaftar dari data dinas PPKUKM DKI Jakarta) pada tanggal : 10-11 Mei 2021.  Salam sehat!",neutral,0.9597646594047546
1038,166014938,2021-05-09 08:24:58+00:00,Kios Jakpreneur dari Pasar Jaya dan Baznas menjadi project mural para seniman Jakarta!  Disparekraf DKI dengan,neutral,0.9093675017356871
