,user_id,date,content_2,sentiment_label,sentiment_score
1970,68304724,2020-11-11 18:20:55+00:00,"Alhamduliah hari ini Penyerahan Modal Usaha Tahap Kedua, kepada penggiat #UMKM se DKI #Jakarta berjalan lancar.. Semoga para penggiat/ pelaku UMKM terus semangat untuk naik kelas di masa Pandemi Covid-19 ini.. Al Faatihah..  #umkmnaikkelas #danastimulan",positive,0.8149968981742859
1969,1602638996,2020-11-11 18:26:10+00:00,"@fahiraidris @BangJaparFI @AntiMiras_ID @DKIJakarta @aniesbaswedan @BangAriza @KUKMPDKIJKT @muhammadhamim Saya mengajukan UMKM DKI Jakarta, ampe skrg blom ada hasilnya Bu. Di saat sprti ini sy hanya berharap dr bantuan UMKM utk menunjang usaha kecil saya.",neutral,0.8648959994316101
1968,166596650,2020-11-12 02:37:40+00:00,"Nara sumber FGD Kementerian Kelautan Perikanan, LPMUKP, utk peningkatan kinerja UMKM dgn berKoperasi. #SYAHNAN PHALIPI. #Management Legal Specialist. #Ketum, Founder HIPMIKINDO Pusat. #CEO Fokus Lawyer International. #Wakil ketua DEKOPIN Jakarta.",neutral,0.9942747950553894
1960,8102722,2020-11-12 11:42:03+00:00,"Karena banyak bantuin UMKM buat branding, marketing dsb., baru tahu kalo Grab punya concern yg sama buat kemajuan UMKM. Mereka bikin tech center di Jakarta untuk pusat inovasi Asia Tenggara. Bakal keren nih! 👍",positive,0.982132077217102
1957,1610879210,2020-11-12 15:03:44+00:00,#News: Dinas Parekraf - STIAMI Gelar Pelatihan Peningkatan Kapasitas UMKM di Jakarta,neutral,0.9955872297286988
1956,213204035,2020-11-12 15:16:28+00:00,Dinas Parekraf - STIAMI Gelar Pelatihan Peningkatan Kapasitas UMKM di Jakarta   #BacadiBJ #BeritaJakarta #JAKI  https://t.co/YMBEElzvbc,neutral,0.9963196516036988
1954,3184723542,2020-11-13 02:04:30+00:00,"Dalam kesempatan lain, di Jakarta, Menteri Erick Thohir mendukung prakarsa tersebut dan menyampaikan harapannya. “Saya harap Sarinah dapat menitikberatkan pada kurasi dan seleksi produk UMKM dan Nusantara yang premium,",neutral,0.917320430278778
1949,17666340,2020-11-13 11:12:22+00:00,"Grab Buka Kantor Pusat Keduanya di Jakarta, Sekaligus Pusat Riset UMKM",neutral,0.9938448667526244
1947,1325175833519009794,2020-11-14 07:13:41+00:00,"*DEKLARASI SILATUROHIM BESAN BETAWI* Sebagai Badan otonom dalam SEHATY yg concern untuk pembinaan seniman, budayawan dan pelaku UMKM Betawi. Kegiatan dirangkai Baksos Donor Darah dan Bazaar UMKM. Dibuka oleh Wagub DKI Jakarta Ariza Patria n Walikota Jaksel H. Marullah Matali.",neutral,0.9870888590812684
1946,1325175833519009794,2020-11-14 07:21:21+00:00,"DEKLARASI SILATUROHIM BESAN BETAWI (SBB) lembaga otonom dalam SEHATY yg concern pembinaan seniman, budayawan, pelaku UMKM Betawi. Kegiatan dirangkai Baksos Donor Darahn Bazzaar UMKM. Dibuka oleh Wagub DKI Jakarta Ariza Patria dan Walkot Jaksel H. Marullah Matali 14-15 Nov 2020.",neutral,0.9824621677398682
1944,166014938,2020-11-14 12:34:04+00:00,"Tandai kalendermu! “BAZAAR ONLINE JAKPRENEUR X SHOPEE” bakal berlangsung 16-20 November 2020.  Bakal ada banyak produk terbaik dari 200 UMKM Jakarta binaan Jakpreneur, dan pastinya harga produknya terjangkau.  #DKIJakarta #Jakpreneur #WirausahaJakarta #umkm #Bazaaronline #shopee",positive,0.7300524711608887
1939,266420798,2020-11-15 11:44:28+00:00,Kadin DKI Jakarta Kritik Pemprov DKI. Info selengkapnya cek,neutral,0.9979693293571472
1938,1536237300,2020-11-15 12:30:49+00:00,"Tandai kalendermu! “BAZAAR ONLINE JAKPRENEUR X SHOPEE” bakal berlangsung 16-20 November 2020.  Bakal ada banyak produk terbaik dari 200 UMKM Jakarta binaan Jakpreneur, &amp; pastinya harga produknya terjangkau. Jgn sampai ketinggalan ya.  Mari kita cintai produk UMKM Indonesia! 🇮🇩",positive,0.8501295447349548
1937,196208994,2020-11-16 05:00:01+00:00,JASA FOTO MAKANAN JABODETABEK &gt;&gt; WA: 0878-2240-1343 &gt;&gt; Follow IG : bwellphotovideo  #makanan #minuman #kafe #cafe #restoran #kekinian #jamannow #bisnis #usaha #pengusaha #wirausaha #pebisnis #ukm #umkm  #jakarta #depok #bogor #jaksel #jakbar #jaktim #jakpus #jakut #bintaro,neutral,0.9473645687103271
1935,1316786357805608964,2020-11-16 05:14:08+00:00,"Pemerintah terus upayakan perbaikan ekonomi dampak covid-19. Melalui UU Cipta Kerja, regulasi yg hambat penciptaan lapangan kerja &amp; pertumbuhan ekonomi direformasi. mudahkan investasi &amp; dukung UMKM #BarisanProKerja #CaraPulihkanEkonomi  #SayaBersamaHabibLutfi Gus Baha Jakarta",neutral,0.9555162191390992
1934,1316786357805608964,2020-11-16 05:15:51+00:00,"Tak hanya Indonesia. Detik ini, semua negara berjuang atasi masalah ekonomi dampak covid-19. UU Cipta Kerja mudahkan investasi sektor manufaktur &amp; dukung UMKM. Biar lapangan kerja baru tercipta luas. #BarisanProKerja #CaraPulihkanEkonomi  #SayaBersamaHabibLutfi Gus Baha Jakarta",neutral,0.935517430305481
1933,1316786357805608964,2020-11-16 05:20:23+00:00,"Kenapa UU Cipta Kerja harus hadir? Saat ini ada 9,7 pengangguran &amp; jutaan usaha gulung tikar. UU ini untuk mudahkan investasi &amp; dukung UMKM supaya lapangan kerja baru tercipta luas. UMKM diberdayakan! #BarisanProKerja #CaraPulihkanEkonomi  #SayaBersamaHabibLutfi Gus Baha Jakarta",neutral,0.9058528542518616
1932,1167087910811623426,2020-11-16 06:01:09+00:00,"Jakpreneur DKI Jakarta Lampaui Target, Mendesain UMKM Saling Sinergi",neutral,0.9904138445854188
1930,1536237300,2020-11-16 07:12:15+00:00,"Sebagai salah satu upaya pemulihan ekonomi di masa pandemi, Pemprov DKI Jakarta bantu UMKM memperoleh bahan baku murah.  Cari tahu apa saja manfaatnya, mekanisme juga lokasi pembelian bahan baku tersebut pada infografik berikut!  #Jakpreneur #WirausahaJakarta #WirausahaKeren",neutral,0.9831390976905824
1929,1219947729155047424,2020-11-16 08:33:56+00:00,"Pemprov DKI Jakarta Beri Bantuan untuk UMKM Agar Bisa Beli Bahan Baku Lebih Murah, Caranya Gampang!",neutral,0.8450673818588257
1926,166014938,2020-11-16 09:02:41+00:00,"Sebagai salah satu upaya pemulihan ekonomi di masa pandemi, Pemprov DKI Jakarta bantu UMKM memperoleh bahan baku murah.  #DKIJakarta #Jakpreneur #WirausahaJakarta #WirausahaKeren #WirausahaPemula #UMKM #WirausahaMuda #Wirausahasukses #BahanBakuMurah",neutral,0.965834617614746
1925,1029961547177574400,2020-11-16 10:22:37+00:00,Pemprov DKI Jakarta Gelar Bazaar Online Dorong UMKM Bangkit  https://t.co/3rGVMmWK8U via @mnews_id #portalberitaumkm,neutral,0.9955952763557434
1924,1052798082419580928,2020-11-16 10:48:32+00:00,"Dorong Pemasaran UMKM, Pemprov DKI Jakarta dan Shopee Gelar Bazaar Online Jakpreneur",neutral,0.9932633042335509
1923,1219947729155047424,2020-11-16 11:20:26+00:00,"Pemprov DKI Jakarta Beri Bantuan untuk UMKM Agar Bisa Beli Bahan Baku Lebih Murah, Caranya Gampang!  https://t.co/iN6VKyWS1n",neutral,0.9874262809753418
1922,1219947729155047424,2020-11-17 00:30:27+00:00,"Pemprov DKI Jakarta Beri Bantuan untuk UMKM Agar Bisa Beli Bahan Baku Lebih Murah, Caranya Gampang!",neutral,0.8450673818588257
1921,3150863989,2020-11-17 02:03:12+00:00,"Webinar Pelatihan Kewirausahaan 2020 UMKM Maju Berdaya di Era Pandemi COVID-19. Hello para pemilik UMKM, Yuk ikut acara hari ini bersama Kepala Seksi Penyuluhan, DPMPTSP Provinsi DKI Jakarta, Rinaldi, S.I.Kom,",neutral,0.988927960395813
1920,1219947729155047424,2020-11-17 03:50:29+00:00,"Bantuan UMKM DKI Jakarta untuk Dapatkan Bahan Baku Harga Murah, Simak Syarat-syaratnya!",neutral,0.9841028451919556
1919,1320328879760756736,2020-11-17 03:50:38+00:00,"Bantuan UMKM DKI Jakarta untuk Dapatkan Bahan Baku Harga Murah, Simak Syarat-syaratnya!",neutral,0.9841028451919556
1916,68930552,2020-11-17 07:55:04+00:00,"Sebagai wujud memberikan wadah bagi pelaku UMKM yang tergabung dalam Jakpreneur, Pemprov DKI Jakarta menyelenggarakan Bazaar Online Jakpreneur. Berkolaborasi dengan toko digital Shopee, acara ini akan diselenggarakan 16-20 November 2020 dengan berbagai rangkaian kegiatan. #MIA20",neutral,0.8988174796104431
1915,68930552,2020-11-17 07:56:26+00:00,Pemprov DKI Jakarta sampai November 2020 ini telah memfasilitasi beridirinya 192.062 UMKM baru ,neutral,0.9957867264747621
1913,47274731,2020-11-17 09:09:14+00:00,"Bangkitkan Semangat UMKM, Pemprov DKI Jakarta Gelar Bazaar Virtual  #LengkapCepatBeritanya #Keuangan #Ekonomi  .",neutral,0.9783332347869872
1912,1610879210,2020-11-17 10:03:12+00:00,#News: Pelaku UMKM di Kepulauan Seribu Senang Ada Akses Internet Gratis JakWIFI,neutral,0.9841497540473938
1909,1090650916221464576,2020-11-18 02:02:29+00:00,Halo min @DKIJakarta @kebijakananies_  @aniesbaswedan  tadi banyak warga Protes di kecamatan makasar jakarta timur untuk mendaftar bansos UMKM katanya sudah di tutup..Apakah Benar atau hanya untuk jatah orang dalam.. Di media diumumkan batasnya tgl 25 November 2020..mohon dijawab,neutral,0.6072859764099121
1908,1090650916221464576,2020-11-18 02:49:04+00:00,"@DerLogik @roses_man Ragu om.. Gw pengen PKS kayak dulu mendekati warganya dgn bansos, UMKM, serta materi kaderisasi door to door kerumah warga.. Apakah sekarang msh ada.. Di tempat gw makasar jakarta timur udh ga pernah lihat😒",neutral,0.39825984835624695
1907,1121442691579932672,2020-11-18 04:41:16+00:00,@DKIJakarta bantuan untuk umkm apa masih dibuka?saya coba buka link pendaftarannya tutup.Mohon bantuan cara pendaftaran online untuk jakarta barat.terima kasih,neutral,0.9874199032783508
1906,2377644162,2020-11-18 07:36:05+00:00,Lagi-lagi Gubernur DKI Jakarta Mendapat Penghargaan. Kali ini mensinkronisasi kan UMKM.   Kok dapet penghargaan terus sih. Gue jadi gedek deh...  @GeiszChalifah @marlina_idha  https://t.co/I6yQYwlRAW,negative,0.8540114760398865
1904,944180887171743745,2020-11-18 10:00:02+00:00,Ini Tiga Strategi Pemprov DKI Pulihkan UMKM Terdampak Pandemi Covid-19  #NEWS #COVID19 #jakarta  https://t.co/2y55c43q4J,neutral,0.9974072575569152
1900,147063992,2020-11-19 07:32:33+00:00,"Inovasi tiada henti. Jakarta buka potensi pasar di masa pandemi utk UMKM binaan Jakpreneur. Jakpreneur itu nama lain dr OKE OCE, yg kini sdh punya 200.000 anggota terdaftar",neutral,0.6792253255844116
1899,1610879210,2020-11-19 08:03:30+00:00,"#News: JPS: Raih Indonesia Government Procurement Award 2020, Pemprov DKI Peduli UMKM",neutral,0.9858790040016174
1896,47596019,2020-11-19 13:53:52+00:00,Bazaar Online Jakpreneur dari Pemprov DKI Jakarta bangkitkan gairah bisnis UMKM di tengah pandemi. Sebanyak 323 peserta akan berpartisipasi dalam acara ini.  Ingin tahu lebih lanjut tentang kegiatan &amp; waktu pelaksanaan Bazaar Online Jakpreneur? Cek di link,neutral,0.991694152355194
1893,754553665,2020-11-20 02:27:42+00:00,"Bismillah, Saya menjual Ikan Nila Merah Premium Quality (Frozen) dari Subang seharga Rp35.000 - Rp40.000. Ayo beli di Shopee!  ⬇️⬇️⬇️  https://t.co/mPDB3APXNe  #shopee #MarketingDigital #Frozen #food #foodie #follotrick #FolloMe #Jakarta #SmallBusiness #umkm #localbusiness",neutral,0.9058549404144288
1889,275580050,2020-11-20 13:50:16+00:00,"Jakarta, InfoPublik - Pemerintah melalui Kementerian Komunikasi dan Informatika RI (@kemkominfo) mendorong masyarakat Indonesia khususnya para pelaku UMKM untuk menjadikan produknya sebagai produk yang berkualitas juga memiliki sertifikasi halal.",neutral,0.9924429059028624
1886,166014938,2020-11-21 14:11:49+00:00,"Pemprov DKI meraih penghargaan Indonesia Government Procurement Award 2020, kategori Inovasi Pengadaan yang Mendukung Transparansi Belanja Pengadaan dari @LKPP_RI.  #DKIJakarta #KotaKolaborasi #GovernmentProcurementAward #LKPPRI #UMKMJakarta #Eorder #BPPBJ https://t.co/vF3fWs33B1",neutral,0.9910607933998108
1884,525117186,2020-11-22 04:13:37+00:00,8. Wisata makanan kaki lima dan UMKM. Wah kalo ini gua yakin setiap sudut kota Jakarta punya tempat makan kaki limanya masing-masing. Makanan kaki lima di Jakarta gak kalah enak kok dari makanan di restoran berbintang. Banyak UMKM makanan di Jakarta yang makananya enak dan murah!,positive,0.9978579878807068
1883,754553665,2020-11-22 13:55:11+00:00,"Bismillah, Saya menjual Ikan Nila Merah Premium Quality (Frozen) dari Subang seharga Rp35.000 - Rp40.000. Ayo beli di Shopee!   https://t.co/UgMSppAjNP  #ayomakanikan #ShopeeID #UMKM #SmallBusiness #follotrick #FolloMe #halal #food #fish #jakarta",neutral,0.906799614429474
1880,1115911191510040577,2020-11-23 03:02:57+00:00,Pemprov DKI Jakarta latih UMKM agar raih prospek bisnis saat pandemi  https://t.co/u25OJoWpLP @aniesbaswedan @DKIJakarta @BappedaDKI @KOMINFOTIKP1000 @JSCLounge @Infojakarta @DiskominfoDKI @BeritaJakarta @DishubDKI_JKT,neutral,0.9951155185699464
1874,1169093578028486656,2020-11-24 07:54:14+00:00,"Anggota Komisi C DPRD DKI Jakarta, Ahmad Lukman Jupiter siap memperjuangkan pelaku UMKM mendapatkan akses permodalan melalui Bank DKI. Mengingat UMKM merupakan salah satu ujung tombak perekonomian daerah.  @DPWNasDemJKT @NasDem   #UMKM  #FraksiNasDemJKT",neutral,0.9942856431007384
1873,1029961547177574400,2020-11-24 09:12:24+00:00,Pemprov DKI Jakarta Berikan Pelatihan UMKM untuk Raih Prospek Bisnis di Masa Pandemi  https://t.co/TS215rMqGG via @mnews_id #portalberitaumkm,neutral,0.9954437017440796
1872,68930552,2020-11-24 09:13:53+00:00,"Untuk mendorong agar UMKM di Jakarta terus bertumbuh, Pemprov DKI Jakarta melalui Dinas Penanaman Modal dan PTSP (PMPTSP) DKI Jakarta menyelenggarakan program 'Antar Jemput Izin Bermotor' atau AJIB ",neutral,0.9959418177604676
1871,22126902,2020-11-24 15:36:01+00:00,Pemprov DKI Jakarta telah menerbitkan 105.000 izin bagi pelaku UMKM di Jakarta.,neutral,0.9979902505874634
1870,180696019,2020-11-24 17:40:17+00:00,"Simak perbincangan SONORA UMKM BUSINESS INSIGHT bersama Ruben Saragih ( Senior Consultant Prasmul-eli ) tentang topik ""Peran dan Tantangan Leader di Tengah Krisis. . Rabu 25 November 2020 Pk.11.00-12.00 wib Di Sonora FM 92 Jakarta . Interaktif: WA/SMS : 0812.112.9200",neutral,0.9939146637916564
1868,281398853,2020-11-25 03:42:11+00:00,MES DKI Jakarta dan MES Mesir Tandatangani MoU Perdagangan Ekspor Senilai Satu Juta USD  PW MES DKI Jakarta dan PWK MES Mesir sepakat menandatangani perjanjian kerjasama untuk melakukan kegiatan perdagangan ekspor produk UMKM Indonesia ke Mesir senilai 1 juta US Dollar.,neutral,0.9968124032020568
1867,1111103573322915840,2020-11-25 05:12:17+00:00,"Batumbu Peduli Tenaga Medis   Team Batumbu turut berperan aktif dalam melindungi tenaga medis serta memberdayakan Wira UMKM dengan memberikan donasi paket APD dan masker untuk tenaga medis di beberapa wilayah Jakarta  Small Act, Saves Lives  @ValidusCapital   #Batumbu #P2Plending",neutral,0.9881350994110109
1864,196208994,2020-11-26 05:00:02+00:00,JASA FOTO MAKANAN JABODETABEK &gt;&gt; WA: 0878-2240-1343 &gt;&gt; Follow IG : bwellphotovideo  #makanan #minuman #kafe #cafe #restoran #kekinian #jamannow #bisnis #usaha #pengusaha #wirausaha #pebisnis #ukm #umkm  #jakarta #depok #bogor #jaksel #jakbar #jaktim #jakpus #jakut #bintaro,neutral,0.9473645687103271
1862,1075268791,2020-11-26 14:47:11+00:00,"Seni mengentang plat menjadi sebuah karya yang menarik dari seorang seniman jogja, Daddysjokes. Karyanya menghiasi gelaran event Parjo - Pasar Jongkok Otomotif tahun 2018 di Museum Purna Bhakti TMII Jakarta. #eventotomotif #umkm #senimanlokal #karyaseni #eventjakarta #infojakarta",neutral,0.6960729360580444
1861,754553665,2020-11-27 03:36:45+00:00,"Bismillah, Saya menjual Ikan Nila Merah Premium Quality (Frozen) dari Subang seharga Rp35.000 - Rp40.000. Ayo beli di Shopee!   https://t.co/paHxPByBU0  #ayomakanikan #halalfood #frozenfood #smallbusiness #localbusiness #UMKM #jakarta #culinary #follotrick #FolloMe #marketing",neutral,0.8428808450698853
1859,47596019,2020-11-28 08:20:02+00:00,UMKM DKI Jakarta Kini Punya Ruang Khusus untuk Naik Kelas,neutral,0.991987943649292
1858,1610879210,2020-11-28 09:03:06+00:00,#News: 20 Pelaku UMKM di KBT Ikuti Pelatihan Digitalisasi Marketing,neutral,0.9966155886650084
1857,196208994,2020-11-29 11:00:00+00:00,JASA FOTO MAKANAN JABODETABEK &gt;&gt; WA: 0878-2240-1343 &gt;&gt; Follow IG : bwellphotovideo  #makanan #minuman #kafe #cafe #restoran #kekinian #jamannow #bisnis #usaha #pengusaha #wirausaha #pebisnis #ukm #umkm  #jakarta #depok #bogor #jaksel #jakbar #jaktim #jakpus #jakut #bintaro,neutral,0.9473645687103271
1856,1175237100125343745,2020-11-30 05:12:05+00:00,"Bila Anir-Lutfi Terpilih, Sandi Siap Pasarkan Produk UMKM Pangkep ke Jakarta",neutral,0.9893052577972412
1855,843455665943150592,2020-11-30 07:45:00+00:00,Ketua DPW Partai Gelora DKI Jakarta Triwicaksana berharap program YES (Yakin Entrepreneur Sukses) bisa segera kolaborasi untuk melakukan advokasi semua unsur dan elemen yang dibutuhkan agar UMKM bisa maju.  @partaigeloraid,neutral,0.9937915205955504
1852,1090650916221464576,2020-11-30 15:07:13+00:00,@zarazettirazr Khusus wilayah jakarta siap diantar uni.. Dan ada harga khusus untuk UMKM jika orderan minimal 5 kg tiap harinya..   #BantuUMKMday   https://t.co/rczFCXBmkq,neutral,0.940510392189026
1851,1029961547177574400,2020-12-01 06:09:27+00:00,UMKM DKI Jakarta Kini Memiliki Ruang Khusus untuk Naik Kelas  https://t.co/5fWm0mG4BS via @mnews_id  #portalberitaumkm,neutral,0.9958786964416504
1849,1316786357805608964,2020-12-01 10:05:41+00:00,"Kehadiran UU Cipta Kerja akan memberikan dampak positif kepada banyak sektor, terutama usaha mikro, kecil dan menengah (UMKM) termasuk industri e-commerce. #BarisanProKerja  . Langit Jakarta mendung, btw #HBDMasGanteng semeru  #UlamaTidakPlayingVictim",neutral,0.6722080707550049
1846,754553665,2020-12-02 22:25:03+00:00,"Bismillah, Saya menjual Ikan Nila Merah Premium Quality (Frozen) dari Subang seharga Rp35.000 - Rp40.000. Ayo beli di Shopee!  Link ⬇️⬇️⬇️  https://t.co/QEhjCsyZ7s  #ayomakanikan #fish #UMKM #halalfood #DigitalMarketing #MarketingDigital #follotrick #FolloMe #culinary #jakarta",neutral,0.9537556171417236
1839,196208994,2020-12-05 02:26:02+00:00,JASA FOTO MAKANAN JABODETABEK &gt;&gt; WA: 0878-2240-1343 &gt;&gt; Follow IG : bwellphotovideo  #makanan #minuman #kafe #cafe #restoran #kekinian #jamannow #bisnis #usaha #pengusaha #wirausaha #pebisnis #ukm #umkm  #jakarta #depok #bogor #jaksel #jakbar #jaktim #jakpus #jakut #bintaro,neutral,0.9473645687103271
1834,196208994,2020-12-06 11:00:01+00:00,JASA FOTO MAKANAN JABODETABEK &gt;&gt; WA: 0878-2240-1343 &gt;&gt; Follow IG : bwellphotovideo  #makanan #minuman #kafe #cafe #restoran #kekinian #jamannow #bisnis #usaha #pengusaha #wirausaha #pebisnis #ukm #umkm  #jakarta #depok #bogor #jaksel #jakbar #jaktim #jakpus #jakut #bintaro,neutral,0.9473645687103271
1831,275580050,2020-12-07 16:20:59+00:00,"Jakarta, InfoPublik - Target pemerintah mendorong pelaku UMKM beralih ke digital telah terlampaui. Pasalnya, target yang ditentukan tahun ini adalah sebanyak 2 juta pelaku UMKM, namun hingga saat ini sudah terdapat sekitar 3,2 juta pelaku beralih digital.",neutral,0.99419504404068
1823,3150863989,2020-12-08 07:43:32+00:00,"Untuk Pelaku UMKM, Ini Stimulus Pemprov DKI Jakarta yang Perlu Kalian Tahu Klik untuk baca:",neutral,0.9967578053474426
1821,1316786357805608964,2020-12-08 11:34:09+00:00,"Di Jakarta, Pulau Bali &amp; semua wilayah pulih. IMF &amp; BI prediksi ekonomi RI pulih 2021. Karena upaya pemerintah siapkan vaksin &amp; stimulus fiskal bantuan2 ke rakyat &amp; UMKM. Juga penciptaan lapangan kerja &amp; investasi dgn UU Cipta Kerja #BarisanProKerja  . . #RameDiTwitter  Cak Nun",neutral,0.9376924633979796
1820,248199104,2020-12-08 11:38:54+00:00,"Anggota Komisi D DPRD Provinsi DKI Jakarta Neneng Hasanah, melaksanakan kegiatan Bina UMKM dengan memberikan bantuan permodalan &amp; rebranding kepada pelaku UMKM di Jakarta.  #DemokratBinaUMKM",neutral,0.9955926537513732
1816,1251440957398020096,2020-12-09 05:38:47+00:00,Automax black pro Kembalikan kendaraan anda yg kusam jadi seperti baru. Produk umkm @AsoppsiOfficial  Uk. 60ml harga 60 rb gratis ongkir u/ wilayah jakarta. Potongan ongkir 10rb untuk luar jakarta. #pewirausahapemula @macan_uTara @ajeng_cute16,neutral,0.9299947023391724
1815,69434114,2020-12-09 14:48:54+00:00,Prabowo somad gibran felix Fpi dan semuanya lapar malam?? Ini dia solusinya #nasigorengmasagus jl tebet raya no 69 jaksel #dirumahaja pesen aja pakai #gojek dan #grabfood #kulinerjakarta #kulinertebet #promomakanan #Jakarta #kulinermurah #UMKM #UMKMhebat #murah #diskon,positive,0.7946709990501404
1809,266420798,2020-12-11 11:37:57+00:00,Kadin DKI Jakarta Siap Berkolaborasi untuk Dukung UMKM. Info selengkapnya cek,neutral,0.9832315444946288
1807,89709462,2020-12-12 02:14:45+00:00,"Mohon tanya, ada nggak jasa  langganan ikan laut segar yang bisa kirim ke daerah Jakarta Selatan?  Silakan yang punya usaha atau mau rekomendasi, diutamakan UMKM.",neutral,0.893894374370575
1806,196208994,2020-12-12 02:26:01+00:00,JASA FOTO MAKANAN JABODETABEK &gt;&gt; WA: 0878-2240-1343 &gt;&gt; Follow IG : bwellphotovideo  #makanan #minuman #kafe #cafe #restoran #kekinian #jamannow #bisnis #usaha #pengusaha #wirausaha #pebisnis #ukm #umkm  #jakarta #depok #bogor #jaksel #jakbar #jaktim #jakpus #jakut #bintaro,neutral,0.9473645687103271
1805,743319071559606273,2020-12-13 07:08:58+00:00,"Halo sobat UMKM,  Yuk teman-teman bisa membagikan wajah Jakarta sekarang yang begitu cantik dengan hashtag #jakartaberbunga   #wajahbarujakarta  #jakartaberbunga",neutral,0.93586528301239
1804,743319071559606273,2020-12-13 07:16:35+00:00,"Halo sobat UMKM,  Yuk sobat kita bagikan wajah jakarta yang begitu cantik.  #jakartaberbunga #wajabbarujakarta #jagajakarta #pemprovdki",neutral,0.8506497740745544
1803,554230513,2020-12-13 07:23:11+00:00,Yukk jajannn di @dapurgadanta cek ig yaa..  @Naunacapek @Naunaback @Elina_Vay @rita_tj @FiersaBesari @restii_ @IvoneHall @jumintenkoplak @bonggbudiharto @Pak_GuruSD @PakattDayak @Kita_AMLTF @victoriayovita @WagimanDeep212_  #umkmjakarta #umkm #bantudagangan #yukkjajan,neutral,0.7766503095626831
1798,1090650916221464576,2020-12-14 00:18:37+00:00,Bismillahirrahmanirrahim..   Lanjut jualan ayam potongnya guys.. Yuk siapa yg mau pesan Harga Rp 32.000/kg..bisa direquest dan dipotong dpt ati ampelanya.. Buat UMKM ada harga khusus minimal 5 ekor.. Bisa diambil dulu bayar belakangan..Pesan via DM atau WA ya.. Khusus dki jakarta,neutral,0.6697108745574951
1796,725300215222145024,2020-12-14 02:38:05+00:00,"Berdayakan UMKM, Alumni SMA Negeri 3 Teladan Jakarta Gelar TBN Fest -",neutral,0.9890523552894592
1793,3477305245,2020-12-14 09:17:44+00:00,Promo kios harga spesial Sewa Kios Langsung Dapat BONUS Gudang  Info : 021 30018865 Website :,neutral,0.9852467775344848
1792,248199104,2020-12-14 10:20:54+00:00,"Anggota Fraksi Partai Demokrat DPRD DKI Jakarta Ali Muhammad Johan Suharli, memberikan bantuan modal penyangga kepada pedagang &amp; pelaku UMKM di Jakarta Selatan, untuk meringankan beban masyarakat di masa pandemi, dengan menggerakkan perekonomian pelaku UMKM.  #DemokratBinaUMKM",neutral,0.9886918067932128
1788,754553665,2020-12-15 01:07:37+00:00,"Subcribe, like and share ya!  https://t.co/cQ1mIixRp1  #enihardi #youtube #channel #content #MarketingDigital #DigitalMarketing #FolloMe #follotrick #folowtrick #tuesdaymotivations #UMKMjakarta #UMKM #jakarta #fish #farm #creator #like #Share",neutral,0.9381538033485411
1785,754553665,2020-12-15 09:33:59+00:00,"Bismillah, Saya menjual Ikan Nila Merah Premium Quality (Frozen) dari Subang seharga Rp35.000 - Rp40.000. Ayo beli di Shopee, Kepoin yuk!  https://t.co/17g5WAzqMu  #ShopeeID #DigitalMarketing #onlineshopping #UMKMjakarta #fish #halalfood #frozenfood #folllowme #folowtrick #yummy",positive,0.9491313695907592
1784,1052798082419580928,2020-12-15 10:47:33+00:00,"Bantu UMKM, Pemprov DKI Jakarta Sediakan Bahan Baku Murah",neutral,0.9897342920303344
1781,754553665,2020-12-15 22:48:08+00:00,"Bismillah, Saya menjual Pepes Ikan Mas Duri Lunak (Frozen) seharga Rp50.000.  Kepoin yuk!  Link ⬇️⬇️ https://t.co/OAn3DlevCM  #ShopeeID #ayomakanikan #DigitalMarketing #MarketingDigital #onlineshopping #halalfood #HealthyFood #folllowme #folowtrick #fish #UMKM #local #jakarta",neutral,0.9161913990974426
1776,135795460,2020-12-16 12:05:16+00:00,Ketua Umum KADIN DKI Jakarta Diana Dewi meminta KADIN Kota Jakarta Barat agar dapat lebih berperan membantu UMKM.,neutral,0.9956952333450316
1773,1260594570204712961,2020-12-17 02:24:29+00:00,"banyak banget yang lagi ngomongin tentang gaji di jakarta.  sebagai UMKM di kota besar memang cukup menjadi tantangan tentang Gaji di jakarta.  so, menurut lo? Gaji di jakarta dengan knowledge yang lo punya apakah udah layak?  #gajijakarta #InvestorPeduliUMKM #umkmnaikkelas",positive,0.5491825938224792
1771,196208994,2020-12-17 05:00:01+00:00,JASA FOTO MAKANAN JABODETABEK &gt;&gt; WA: 0878-2240-1343 &gt;&gt; Follow IG : bwellphotovideo  #makanan #minuman #kafe #cafe #restoran #kekinian #jamannow #bisnis #usaha #pengusaha #wirausaha #pebisnis #ukm #umkm  #jakarta #depok #bogor #jaksel #jakbar #jaktim #jakpus #jakut #bintaro,neutral,0.9473645687103271
1770,734005284713041920,2020-12-17 05:24:33+00:00,"Realisasi Program Pemulihan Ekonomi Nasional untuk Koperasi dan UMKM Capai Rp87,083 Triliun: JAKARTA, EDUNEWS.ID- Realisasi program Pemulihan Ekonomi Nasional (PEN) untuk Koperasi dan UMKM terus dipercepat dan menunjukkan peningkatan. PEN untuk KUMKM…",neutral,0.9841653108596802
1763,124390203,2020-12-17 12:24:29+00:00,"Kehadiran vaksin covid  diperkirakan akan segera memulihkan dunia usaha seperti pariwisata, ekonomi kreatif dan  UMKM.  Seperti apa optimisme dunia usaha terhadap hadirnya vaksin?   BESOK kami obrolin ini di #RuangPublikKBR   Di Jakarta via @1042mstrifm",neutral,0.995072066783905
1760,124390203,2020-12-18 00:23:04+00:00,"LIVE NOW!  Kehadiran vaksin covid  diperkirakan akan segera memulihkan dunia usaha seperti pariwisata, ekonomi kreatif dan  UMKM.  Seperti apa optimisme dunia usaha terhadap hadirnya vaksin?   Sesaat lagi kami obrolin di #RuangPublikKBR   Di Jakarta via @1042mstrifm",neutral,0.992813766002655
